claim_id,page,proposition,cited_for,cited_case,retrieved_case,supporting_language,assessment,cl_url,cl_status,diagnostics,opinion_file,syllabus,quoted_text,brief_sentence,quote_check,quote_check_worst,quote_floor,crosscheck_flags,triage_track,prescreen_hint,support,badge_label,brief_block,opinion_block,finding_analysis,assessed_by
payne-41,28,"For a citizen's arrest to be valid, the citizen must use no more force than is reasonable under the circumstances, and deadly force in effecting an arrest is limited to self-defense or to a situation necessary to prevent a forcible felony.",,"Prayor v. State, 217 Ga. App. 56, 58",Prayor v. State,,Green,https://www.courtlistener.com/opinion/1253106/prayor-v-state/,VERIFIED,,opinions/Prayor_v_State.html,,"[""... Ga. Code Ann. § 17-4-60 provides that a private citizen may make an arrest if a felony is committed in his presence or within his immediate knowledge. A private citizen may make an arrest upon reasonable and probable grounds of suspicion if the offense is a felony and the offender is escaping or trying to escape."", ""However, for a citizen's arrest to be valid, the citizen must use no more force than is reasonable under the circumstances. Deadly force in effecting an arrest is limited to self-defense or to a situation in which it is necessary to prevent a forcible felony. ...""]","""... However, for a citizen's arrest to be valid, the citizen must use no more force than is reasonable under the circumstances. Deadly force in effecting an arrest is limited to self-defense or to a situation in which it is necessary to prevent a forcible felony. ...""Prayor v. State, 217 Ga. App. 56, 58.","[{""quote"": ""... Ga. Code Ann. \u00a7 17-4-60 provides that a private citizen may make an arrest if a felony is committed in his presence or within his immediate knowledge. A private citizen may make an arrest upon reasonable and probable grounds of suspicion if the offense is a felony and the offender is escaping or trying to escape."", ""result"": ""CLOSE"", ""similarity"": 0.79, ""matched_passage"": ""The transcript reveals the charge given by the trial court was taken from the Supreme Court case of Hayes v. State, 261 Ga. 439, 443 (6) (a) ( 405 SE2d 660 ) (1991), wherein that Court stated *58 as follows: \u201cOCGA \u00a7 17-4-60 provides that a private citizen may make an arrest if a felony is committed in his presence or within his immediate knowledge. A private citizen may make an arrest upon reasonable and probable grounds of suspicion if the offense is a felony and the offender is escaping or trying to escape. For a citizen\u2019s arrest to be valid, the citizen must use no more force than is reasonable under the circum""}, {""quote"": ""However, for a citizen's arrest to be valid, the citizen must use no more force than is reasonable under the circumstances. Deadly force in effecting an arrest is limited to self-defense or to a situation in which it is necessary to prevent a forcible felony. ..."", ""result"": ""CLOSE"", ""similarity"": 0.79, ""matched_passage"": ""A private citizen may make an arrest upon reasonable and probable grounds of suspicion if the offense is a felony and the offender is escaping or trying to escape. For a citizen\u2019s arrest to be valid, the citizen must use no more force than is reasonable under the circumstances. . . . Also, . . . deadly force in effecting an arrest is limited to self-defense or to a situation in which it is necessary to prevent a forcible felony.\u201d Id. See also Prayor v. State, 214 Ga. App. 132, 133 ( 447 SE2d 155 ) (1994).""}]",CLOSE,,,full,,supported,Supported,"However, for a citizen's arrest to be valid, the citizen must use no more force than is reasonable under the circumstances. Deadly force in effecting an arrest is limited to self-defense or to a situation in which it is necessary to prevent a forcible felony. [...] Prayor v. State, 217 Ga. App. 56, 58.","For a citizen's arrest to be valid, the citizen must use no more force than is reasonable under the circumstances. . . . Also, . . . deadly force in effecting an arrest is limited to self-defense or to a situation in which it is necessary to prevent a forcible felony.","Prayor directly supports this proposition. At star-page 58 the opinion quotes Hayes v. State for the rule that a valid citizen's arrest requires no more force than is reasonable under the circumstances and that deadly force is limited to self-defense or to preventing a forcible felony. The brief's language tracks the opinion closely; the quote-check CLOSE flag reflects minor transcription differences (the brief drops the internal ellipses), not a substantive mismatch.",claude-opus-4-8/assess-v2
payne-42,28,The use of force during a citizen's arrest is limited to what is reasonably necessary; deadly force is only permissible in self-defense or to prevent the commission of a forcible felony.,,"Prayor v. State, 217 Ga. App. 56",Prayor v. State,,Green,https://www.courtlistener.com/opinion/1253106/prayor-v-state/,VERIFIED,,opinions/Prayor_v_State.html,,[],"Otherwise, the use of such force may lead to charges such as assault, battery, or even homicide, depending on the degree of force used and the resulting harm. Prayor v. State, 217 Ga. App. 56, Hayes v. State, 261 Ga. 439 (1991).",[],NO_QUOTES,,,fast,,supported,Supported,"Otherwise, the use of such force may lead to charges such as assault, battery, or even homicide, depending on the degree of force used and the resulting harm. Prayor v. State, 217 Ga. App. 56, Hayes v. State, 261 Ga. 439 (1991).","For a citizen's arrest to be valid, the citizen must use no more force than is reasonable under the circumstances. . . . Also, . . . deadly force in effecting an arrest is limited to self-defense or to a situation in which it is necessary to prevent a forcible felony.","The proposition that force in a citizen's arrest is limited to what is reasonably necessary and that deadly force is permissible only in self-defense or to prevent a forcible felony is exactly the rule Prayor quotes from Hayes v. State at star-page 58. The surrounding brief sentence about resulting assault/battery/homicide charges is context the opinion does not address, but the cited-for legal principle is fully supported.",claude-opus-4-8/assess-v2
payne-43,28,The use of force during a citizen's arrest is limited to what is reasonably necessary; deadly force is only permissible in self-defense or to prevent the commission of a forcible felony.,,"Hayes v. State, 261 Ga. 439 (1991)",Hayes v. State,,Green,https://www.courtlistener.com/opinion/1233384/hayes-v-state/,VERIFIED,,opinions/Hayes_v_State.html,,[],"Otherwise, the use of such force may lead to charges such as assault, battery, or even homicide, depending on the degree of force used and the resulting harm. Prayor v. State, 217 Ga. App. 56, Hayes v. State, 261 Ga. 439 (1991).",[],NO_QUOTES,,,fast,,supported,Supported,"Otherwise, the use of such force may lead to charges such as assault, battery, or even homicide, depending on the degree of force used and the resulting harm. Prayor v. State, 217 Ga. App. 56, Hayes v. State, 261 Ga. 439 (1991).","For a citizen's arrest to be valid, the citizen must use no more force than is reasonable under the circumstances. ... [D]eadly force in effecting an arrest is limited to self-defense or to a situation in which it is necessary to prevent a forcible felony. OCGA § 17-4-20.","The opinion directly supports this proposition. In discussing whether the trial court should have charged involuntary manslaughter, the court stated that for a citizen's arrest to be valid the citizen must use no more force than is reasonable under the circumstances, and that deadly force in effecting an arrest is limited to self-defense or to preventing a forcible felony, citing OCGA § 17-4-20. That tracks the brief's proposition closely.",claude-opus-4-8/assess-v2
payne-44,29,"Deadly force is justified if the individual reasonably believes it is necessary to prevent death or great bodily injury to themselves or a third person, or to prevent a forcible felony.",,"Prayor v. State, 217 Ga. App. 56",Prayor v. State,,Yellow,https://www.courtlistener.com/opinion/1253106/prayor-v-state/,VERIFIED,,opinions/Prayor_v_State.html,,[],"Specifically, deadly force is justified if the individual reasonably believes it is necessary to prevent death or great bodily injury to themselves or a third person, or to prevent a forcible felony. Prayor v. State, 217 Ga. App. 56, OCGA § 16-3-21, Chambers v. State, 308 Ga. App. 748.",[],NO_QUOTES,,,fast,,partial,Overstated -- case partially supports,"Specifically, deadly force is justified if the individual reasonably believes it is necessary to prevent death or great bodily injury to themselves or a third person, or to prevent a forcible felony. Prayor v. State, 217 Ga. App. 56, OCGA § 16-3-21, Chambers v. State, 308 Ga. App. 748.",deadly force in effecting an arrest is limited to self-defense or to a situation in which it is necessary to prevent a forcible felony.,"Prayor supports the 'prevent a forcible felony' branch and, broadly, the 'self-defense' branch of this proposition. But the opinion states the rule simply as 'self-defense' and does not articulate the elaborated standard the brief recites -- a reasonable belief that force is necessary to prevent death or great bodily injury to oneself or a third person. That formulation comes from the self-defense statute (OCGA § 16-3-21), which the brief also cites, not from Prayor. The citation thus partially supports the proposition: the forcible-felony limit is in the case, but the specific deadly-force-in-self-defense standard is not.",claude-opus-4-8/assess-v2
payne-45,29,"Deadly force is justified if the individual reasonably believes it is necessary to prevent death or great bodily injury to themselves or a third person, or to prevent a forcible felony.",,"Chambers v. State, 308 Ga. App. 748",Chambers v. State,,Green,https://www.courtlistener.com/opinion/2502836/chambers-v-state/,VERIFIED,,opinions/Chambers_v_State.html,,[],"Specifically, deadly force is justified if the individual reasonably believes it is necessary to prevent death or great bodily injury to themselves or a third person, or to prevent a forcible felony. Prayor v. State, 217 Ga. App. 56, OCGA § 16-3-21, Chambers v. State, 308 Ga. App. 748.",[],NO_QUOTES,,,fast,,supported,Supported,"Specifically, deadly force is justified if the individual reasonably believes it is necessary to prevent death or great bodily injury to themselves or a third person, or to prevent a forcible felony. Prayor v. State, 217 Ga. App. 56, OCGA § 16-3-21, Chambers v. State, 308 Ga. App. 748.",[A] person is justified in using force which is intended or likely to cause death or great bodily harm only if he or she reasonably believes that such force is necessary to prevent death or great bodily injury to himself or herself or a third person or to prevent the commission of a forcible felony.,"Chambers quotes OCGA § 16-3-21 (a) and applies it as the controlling justification standard, including the precise rule that force intended or likely to cause death or great bodily harm is justified only on a reasonable belief that it is necessary to prevent death or great bodily injury to oneself or a third person, or to prevent a forcible felony. That statutory language tracks the brief's proposition almost word for word, so the cited case supports the stated principle.",claude-opus-4-8/assess-v2
payne-46,29,"Excessive or unlawful force, even when acting in self-defense, is not justifiable.",,"Reddick v. State, 321 Ga. 73 (2025)",Reddick v. State,,Green,https://www.courtlistener.com/opinion/10680534/reddick-v-state/,VERIFIED,,opinions/Reddick_v_State.html,,[],"Excessive or unlawful force, even when acting in self-defense, is not justifiable. Reddick v. State, 321 Ga. 73 (2025).",[],NO_QUOTES,,,fast,,supported,Supported,"Excessive or unlawful force, even when acting in self-defense, is not justifiable. Reddick v. State, 321 Ga. 73 (2025).",“The use of excessive force or unlawful force while acting in self-defense is not justifiable.”,"Reddick v. State directly supports this proposition. In its self-defense sufficiency analysis the opinion states (quoting Clark v. State, 271 Ga. 27, 29) that “[t]he use of excessive force or unlawful force while acting in self-defense is not justifiable,” and adds that deadly force “is not justified if the degree of force used by the defendant exceeds that which a reasonable person would believe necessary to defend against the victim's unlawful actions.” The brief's sentence is a faithful restatement of that rule.",claude-opus-4-8/assess-v2
payne-47,29,"The use of unreasonable force could not be part of a legitimate citizen's arrest, and such actions may lead to criminal liability.",,"Patel v. State, 279 Ga. 750",Patel v. State,,Yellow,https://www.courtlistener.com/opinion/1245424/patel-v-state/,VERIFIED,,opinions/Patel_v_State.html,,[],"In Patel v. State, 279 Ga. 750, the Court emphasized that the use of unreasonable force could not be part of a legitimate citizen's arrest, and such actions may lead to criminal liability.",[],NO_QUOTES,,"{""toa_mismatch"": {""variants"": [""Patel v. State, 279 Ga. 750"", ""Patel v. State, 279 Ga. 50""]}}",full,,partial,Overstated -- case partially supports,"In Patel v. State, 279 Ga. 750, the Court emphasized that the use of unreasonable force could not be part of a legitimate citizen's arrest, and such actions may lead to criminal liability.","“Although a private person may make a citizen’s arrest under OCGA § 17-4-60, only force that is reasonable under the circumstances may be used to restrain the individual arrested ... the use of unreasonable force . . . could not have been part of a legitimate citizen’s arrest.”","Patel v. State directly states the first half of the proposition: quoting Carter v. State, the court recites that “only force that is reasonable under the circumstances may be used to restrain the individual arrested” and that “the use of unreasonable force . . . could not have been part of a legitimate citizen’s arrest.” To that extent the citation is accurate.

The added clause — that such actions “may lead to criminal liability” — is not a holding of the case. Patel is an ineffective-assistance-of-counsel decision in a felony-murder appeal; it discusses the unreasonable-force principle only to explain why the evidence did not warrant a jury charge on citizen's arrest, not to announce a rule about criminal liability flowing from excessive force. The brief extends the holding modestly beyond what the case decided.",claude-opus-4-8/assess-v2
payne-48,29,A citizen's arrest charge is not warranted where the defendant did not personally witness the crime.,No citizen's arrest instruction required where defendant did not personally witness the crime.,"Nelson v. State, 283 Ga. 119, 121 (2008)",Nelson v. State,,Red,https://www.courtlistener.com/opinion/1374685/nelson-v-state/,VERIFIED,,opinions/Nelson_v_State.html,,[],"A citizen's arrest charge is not warranted unless there is some evidence to support each statutory element. See Nelson v. State, 283 Ga. 119, 121 (2008) (no citizen's arrest instruction required where defendant did not personally witness the crime).",[],NO_QUOTES,,,fast,,unsupported,Case on unrelated subject,"A citizen's arrest charge is not warranted unless there is some evidence to support each statutory element. See Nelson v. State, 283 Ga. 119, 121 (2008) (no citizen's arrest instruction required where defendant did not personally witness the crime).",,"Nelson v. State is a Georgia Supreme Court felony murder case about a fatal shooting outside a Valdosta bar and the defendant's justification defense. It does not address citizen's arrest. The opinion's jury-instruction discussion concerns only whether the defendant was entitled to charges on voluntary manslaughter, involuntary manslaughter, and reckless conduct as part of an ineffective-assistance claim; the page cited (121) is the start of the ineffective-assistance division. Nothing in the opinion mentions citizen's arrest, its statutory elements, or any requirement that a defendant personally witness a crime. The proposition attributed to this case does not appear in it.",claude-opus-4-8/assess-v2
payne-49,29,The use of deadly force in effectuating a citizen's arrest must be reasonable and necessary under the circumstances.,,"Davis v. State, 269 Ga. 276, 277 (1998)",Davis v. State,,Red,https://www.courtlistener.com/opinion/1398343/davis-v-state/,VERIFIED,,opinions/Davis_v_State.html,,[],"Moreover, the use of deadly force in effectuating a citizen's arrest must be reasonable and necessary under the circumstances. See OCGA § 17-4-20(b); Davis v. State, 269 Ga. 276, 277 (1998).",[],NO_QUOTES,,"{""toa_mismatch"": {""variants"": [""Davis v. State, 285 Ga. 343 (2009)"", ""Davis v. State, 269 Ga. 276, 277 (1998)""]}}",full,,unsupported,Case on unrelated subject,"Moreover, the use of deadly force in effectuating a citizen's arrest must be reasonable and necessary under the circumstances. See OCGA § 17-4-20(b); Davis v. State, 269 Ga. 276, 277 (1998).",,"Davis v. State, 269 Ga. 276 (1998), is a felony-murder appeal about the stabbing death of Danny Reid. It does not address the use of deadly force in effecting a citizen's arrest, OCGA § 17-4-20(b), or any reasonableness-and-necessity standard for arrest force. The opinion's four divisions cover sufficiency of the evidence for felony murder, the admissibility of a first-offender guilty plea as similar-transaction evidence, the trial court's refusal to give a requested accident instruction, and Edge/Russell sequential-charge instructions. Nothing in the text touches citizen's arrest or deadly force in arrest. The proposition is attributed to a case that contains no such principle.",claude-opus-4-8/assess-v2
payne-50,30,Trial counsel was not deficient for failing to request an instruction not adjusted to the evidence.,No ineffective assistance for failing to request a charge not adjusted to the evidence.,"Hamm v. State, 294 Ga. 791, 795 (2014)",Hamm v. State,,Red,https://www.courtlistener.com/opinion/2687390/hamm-v-state/,VERIFIED,,opinions/Hamm_v_State.html,,[],"Thus, trial counsel was not deficient for failing to request an unsupported instruction. See Hamm v. State, 294 Ga. 791, 795 (2014) (no ineffective assistance for failing to request a charge not adjusted to the evidence).",[],NO_QUOTES,,,fast,,unsupported,Case on unrelated subject,"Thus, trial counsel was not deficient for failing to request an unsupported instruction. See Hamm v. State, 294 Ga. 791, 795 (2014) (no ineffective assistance for failing to request a charge not adjusted to the evidence).",,"Hamm v. State is a direct-appeal murder case about whether the trial court erred in declining to give a requested jury instruction on accomplice corroboration. It does not address ineffective assistance of counsel. The opinion contains no discussion of deficient performance, Strickland, or trial counsel's conduct at all; it analyzes only whether the requested charge was authorized by ""slight evidence"" and concludes the trial court erred in refusing it but that the error was harmless. The brief cites the case for an ineffective-assistance principle -- that counsel is not deficient for failing to request a charge not adjusted to the evidence -- that appears nowhere in the opinion. The pincite (page 795) falls within the court's discussion of why refusing the instruction was error, the opposite posture from a deference-to-counsel holding.",claude-opus-4-8/assess-v2
payne-51,30,"A citizen's arrest requires the use of no more force than is reasonable under the circumstances, with deadly force limited to self-defense or preventing a forcible felony, and force is not justified if the individual was the initial aggressor unless they withdraw and effectively communicate their intent to do so.",,"Prayor v. State, 217 Ga. App. 56",Prayor v. State,,Yellow,https://www.courtlistener.com/opinion/1253106/prayor-v-state/,VERIFIED,,opinions/Prayor_v_State.html,,[],"A citizen's arrest under OCGA § 17-4-60 requires that the arresting individual use no more force than is reasonable under the circumstances, and deadly force is limited to self-defense or preventing a forcible felony Prayor v. State, 217 Ga. App. 56, Hayes v. State, 261 Ga. 439.",[],NO_QUOTES,,,fast,,partial,Overstated -- case partially supports,"A citizen's arrest under OCGA § 17-4-60 requires that the arresting individual use no more force than is reasonable under the circumstances, and deadly force is limited to self-defense or preventing a forcible felony[.] Prayor v. State, 217 Ga. App. 56, Hayes v. State, 261 Ga. 439.","For a citizen's arrest to be valid, the citizen must use no more force than is reasonable under the circumstances. . . . Also, . . . deadly force in effecting an arrest is limited to self-defense or to a situation in which it is necessary to prevent a forcible felony.","The first two components of this proposition -- no more force than reasonable, and deadly force limited to self-defense or preventing a forcible felony -- are squarely supported by the Hayes rule Prayor quotes. The third component, however, is not in the opinion: Prayor says nothing about an 'initial aggressor' losing justification unless he withdraws and effectively communicates his intent. That aggressor/withdrawal doctrine appears nowhere in this case. The citation supports the reasonable-force and deadly-force portions but overstates by attributing the aggressor rule to Prayor.",claude-opus-4-8/assess-v2
payne-52,30,"A citizen's arrest requires the use of no more force than is reasonable under the circumstances, with deadly force limited to self-defense or preventing a forcible felony, and force is not justified if the individual was the initial aggressor unless they withdraw and effectively communicate their intent to do so.",,"Hayes v. State, 261 Ga. 439",Hayes v. State,,Yellow,https://www.courtlistener.com/opinion/1233384/hayes-v-state/,VERIFIED,,opinions/Hayes_v_State.html,,[],"A citizen's arrest under OCGA § 17-4-60 requires that the arresting individual use no more force than is reasonable under the circumstances, and deadly force is limited to self-defense or preventing a forcible felony Prayor v. State, 217 Ga. App. 56, Hayes v. State, 261 Ga. 439.",[],NO_QUOTES,,,fast,,partial,Overstated -- case partially supports,"A citizen's arrest under OCGA § 17-4-60 requires that the arresting individual use no more force than is reasonable under the circumstances, and deadly force is limited to self-defense or preventing a forcible felony Prayor v. State, 217 Ga. App. 56, Hayes v. State, 261 Ga. 439.","OCGA § 17-4-60 provides that a private citizen may make an arrest if a felony is committed in his presence or within his immediate knowledge. ... For a citizen's arrest to be valid, the citizen must use no more force than is reasonable under the circumstances. ... [D]eadly force in effecting an arrest is limited to self-defense or to a situation in which it is necessary to prevent a forcible felony. OCGA § 17-4-20.","The first half of this proposition is well supported: the opinion expressly states, in connection with OCGA § 17-4-60, that a valid citizen's arrest requires no more force than is reasonable under the circumstances and that deadly force is limited to self-defense or preventing a forcible felony. The second half of the proposition, however -- that force is not justified if the individual was the initial aggressor unless they withdraw and effectively communicate their intent to do so -- does not appear in this opinion. Hayes does not address initial-aggressor or withdrawal doctrine at all; that principle is added by the brief and is not attributable to this case. Because the proposition extends beyond what the opinion decided, it is only partially supported.",claude-opus-4-8/assess-v2
