claim_id,page,proposition,cited_for,cited_case,retrieved_case,supporting_language,assessment,cl_url,cl_status,diagnostics,opinion_file,syllabus,quoted_text,brief_sentence,quote_check,quote_check_worst,quote_floor,crosscheck_flags,triage_track,prescreen_hint,support,badge_label,brief_block,opinion_block,finding_analysis,assessed_by
payne-31,26,The fact that a defendant and his present counsel disagree with a decision made by trial counsel does not require a finding that the defendant's original representation was inadequate.,,"Mahan v. State, 282 Ga. App. 201, 204 (2006)",Mahan v. State,,Green,https://www.courtlistener.com/opinion/7922975/mahan-v-state/,VERIFIED,,opinions/Mahan_v_State.html,,"[""The fact that defendant and his present counsel disagree with the decision made by trial counsel does not require a finding that defendant's original representation was inadequate.""]","“The fact that defendant and his present counsel disagree with the decision made by trial counsel does not require a finding that defendant's original representation was inadequate.” Mahan v. State, 282 Ga. App. 201, 204 (2006).","[{""quote"": ""The fact that defendant and his present counsel disagree with the decision made by trial counsel does not require a finding that defendant's original representation was inadequate."", ""result"": ""CLOSE"", ""similarity"": 0.8, ""matched_passage"": ""l\u2019s decisions as to tactics and strategy, including the scope of cross-examination, generally do not amount to ineffective assistance of counsel. 13 \u201cThe fact that defendant and his present counsel disagree with the decision made by trial counsel does not require a finding that defendant\u2019s original representation was inadequate.\u201d 14 Based on the record before us, the trial court did not err in concluding that trial counsel ren""}]",CLOSE,,,full,,supported,Supported,"“The fact that defendant and his present counsel disagree with the decision made by trial counsel does not require a finding that defendant's original representation was inadequate.” Mahan v. State, 282 Ga. App. 201, 204 (2006).",,"The opinion states this principle in nearly identical words in its ineffective-assistance discussion: ""The fact that defendant and his present counsel disagree with the decision made by trial counsel does not require a finding that defendant's original representation was inadequate."" The brief's quotation matches the opinion's language (the only divergence is a straight-versus-curly apostrophe), and the proposition is directly and accurately supported.",claude-opus-4-8/assess-v2
payne-32,26,Trial counsel's decisions relating to strategy and tactics are not judged by hindsight.,,"Jones v. State, 296 Ga. 561, 567 (769 SE2d 307) (2015)",Jones v. State,,Green,https://www.courtlistener.com/opinion/2779582/jones-v-state/,VERIFIED,,opinions/Jones_v_State.html,,"[""[t]rial counsel's decisions relating to strategy and tactics are not judged by hindsight.""]","Moreover, “[t]rial counsel's decisions relating to strategy and tactics are not judged by hindsight.” Jones v. State, 296 Ga. 561, 567 (769 SE2d 307) (2015).","[{""quote"": ""[t]rial counsel's decisions relating to strategy and tactics are not judged by hindsight."", ""result"": ""CLOSE"", ""similarity"": 0.79, ""matched_passage"": ""bility since one was appellant\u2019s sister and the other a woman with whom he apparently had an intimate relationship. Trial counsel\u2019s decisions relating to strategy and tactics are not judged by hindsight. See Grissom v. State, 296 Ga. 406 ( 768 SE2d 494 ) (2015).""}]",CLOSE,,"{""toa_mismatch"": {""variants"": [""Jones v. State, 283 Ga. 155 (2008)"", ""Jones v. State, 296 Ga. 561, 567 (769 SE2d 307) (2015)""]}}",full,,supported,Supported,"Moreover, “[t]rial counsel's decisions relating to strategy and tactics are not judged by hindsight.” Jones v. State, 296 Ga. 561, 567 (769 SE2d 307) (2015).",,"The opinion supports the proposition directly. In its ineffective-assistance analysis of trial counsel's decision not to call alibi witnesses, the Jones court states verbatim, “Trial counsel's decisions relating to strategy and tactics are not judged by hindsight,” and the brief quotes that sentence with only the conventional bracketed capitalization of the leading letter. The pincite to page 567 is consistent with the star-pagination in the opinion (the sentence falls within the *567 page span).",claude-opus-4-8/assess-v2
payne-33,26,Trial strategy is judged from counsel's perspective at the time of trial and under the particular circumstances of the case.,,"Butler v. State, 313 Ga. 675, 683, 872 S.E.2d 722, 731 (2022)",Butler v. State,,Green,https://www.courtlistener.com/opinion/10679906/butler-v-state/,VERIFIED,,opinions/Butler_v_State.txt,,"[""from counsel's perspective at the time of trial and under the particular circumstances of the case.""]","Trial strategy is judged “from counsel's perspective at the time of trial and under the particular circumstances of the case.” Butler v. State, 313 Ga. 675, 683, 872 S.E.2d 722, 731 (2022).","[{""quote"": ""from counsel's perspective at the time of trial and under the particular circumstances of the case."", ""result"": ""CLOSE"", ""similarity"": 0.79, ""matched_passage"": ""decisions of counsel\u2014in this case, whether to advise his client to waive his right to a jury trial\u2014are to be \u201cexamined from counsel\u2019s perspective at the time of trial and under the particular circumstances of the case.\u201d Taylor v. State, 312 Ga.""}]",CLOSE,,"{""pincite_flag"": {""pinpoint"": ""683"", ""star_range"": [3, 9]}}",full,,supported,Supported,"Trial strategy is judged “from counsel's perspective at the time of trial and under the particular circumstances of the case.” Butler v. State, 313 Ga. 675, 683, 872 S.E.2d 722, 731 (2022).","the reasonableness of strategic decisions of counsel—in this case, whether to advise his client to waive his right to a jury trial—are to be “examined from counsel’s perspective at the time of trial and under the particular circumstances of the case.”","Butler v. State supports the proposition: in its ineffective-assistance analysis the opinion adopts and applies the standard that the reasonableness of counsel's strategic decisions is examined from counsel's perspective at the time of trial and under the particular circumstances of the case. The opinion quotes this language (from Taylor v. State) and uses it to evaluate counsel's advice to waive a jury trial, so the brief's general statement of the standard is accurate. The quote is faithful in substance; the brief omits the introductory word “examined” that immediately precedes the quoted phrase in the opinion, which accounts for the CLOSE quote-check rating but does not affect the proposition's support.",claude-opus-4-8/assess-v2
payne-34,27,The decision whether to pursue a defense theory or request a specific jury charge is a question of trial strategy that will not be second-guessed unless it is so patently unreasonable that no competent attorney would have chosen it.,,"Smith v. State, 314 Ga. App. 583, 588 (2012)",Smith v. State,,Yellow,https://www.courtlistener.com/opinion/2502877/smith-v-state/,VERIFIED,,opinions/Smith_v_State.html,,"[""a question of trial strategy"", ""so patently unreasonable that no competent attorney would have chosen it.""]","The decision whether to pursue a defense theory or request a specific jury charge is “a question of trial strategy” that will not be second-guessed unless it is “so patently unreasonable that no competent attorney would have chosen it.” Smith v. State, 314 Ga. App. 583, 588 (2012).","[{""quote"": ""a question of trial strategy"", ""result"": ""FABRICATED"", ""similarity"": 0.57, ""matched_passage"": ""At the conclusion of the trial, the jury returned a verdict finding Smith guilty of the false imprisonment offense. 1.""}, {""quote"": ""so patently unreasonable that no competent attorney would have chosen it."", ""result"": ""CLOSE"", ""similarity"": 0.79, ""matched_passage"": ""jury charges to request are strategic and \u201cprovide no grounds for reversal unless such tactical decisions are so patently unreasonable that no competent attorney would have chosen them.\u201d (Punctuation and footnote omitted.) Wilburn, supra, 278 Ga. App.""}]",FABRICATED,Yellow,,full,,supported,Reworded -- not a verbatim quote,"The decision whether to pursue a defense theory or request a specific jury charge is “a question of trial strategy” that will not be second-guessed unless it is “so patently unreasonable that no competent attorney would have chosen it.” Smith v. State, 314 Ga. App. 583, 588 (2012).","Generally, decisions about which defense theories to pursue and which jury charges to request are strategic and “provide no grounds for reversal unless such tactical decisions are so patently unreasonable that no competent attorney would have chosen them.”","The cited case supports the underlying proposition. At page 588 the opinion holds that “decisions about which defense theories to pursue and which jury charges to request are strategic” and provide no grounds for reversal “unless such tactical decisions are so patently unreasonable that no competent attorney would have chosen them.” That is exactly the trial-strategy/deference principle the brief invokes.

The quotation marks, however, are not accurate. “A question of trial strategy” does not appear in the opinion; the court says the decisions “are strategic.” And the brief’s second quotation ends “...chosen it,” whereas the opinion reads “...chosen them,” and the quoted phrase is part of the longer clause “provide no grounds for reversal unless such tactical decisions are so patently unreasonable....” The substance is sound, but counsel has presented reworded language as a verbatim quote and should conform the quotation to the opinion’s actual words.",claude-opus-4-8/assess-v2
payne-35,27,The court has declined to presume prejudice in the context of an ineffective assistance of counsel claim based on attorney performance.,,"Bradley v. State, 318 Ga. 142, 144 (2024)",Bradley v. State,,Green,https://www.courtlistener.com/opinion/10680416/bradley-v-state/,VERIFIED,,opinions/Bradley_v_State.txt,,"[""[T]his Court has declined to presume prejudice in the context of an ineffective assistance of counsel claim based on attorney performance.""]","Even assuming arguendo that counsel should have requested the charge, Defendant failed to demonstrate prejudice. “[T]his Court has declined to presume prejudice in the context of an ineffective assistance of counsel claim based on attorney performance.” Bradley v. State, 318 Ga. 142, 144 (2024).","[{""quote"": ""[T]his Court has declined to presume prejudice in the context of an ineffective assistance of counsel claim based on attorney performance."", ""result"": ""CLOSE"", ""similarity"": 0.8, ""matched_passage"": ""Bradley asserts without elaboration that \u201cprejudice 7 should be presumed.\u201d But Bradley ignores that \u201cthis Court has declined to presume prejudice in the context of an ineffective assistance of counsel claim based on attorney performance[.]\u201d Keller v. State, 308 Ga. 492, 496 (2) (a) (842 SE2d 22) (2020); see also Reid v.""}]",CLOSE,,,full,,supported,Supported,"Even assuming arguendo that counsel should have requested the charge, Defendant failed to demonstrate prejudice. “[T]his Court has declined to presume prejudice in the context of an ineffective assistance of counsel claim based on attorney performance.” Bradley v. State, 318 Ga. 142, 144 (2024).","Bradley asserts without elaboration that “prejudice should be presumed.” But Bradley ignores that “this Court has declined to presume prejudice in the context of an ineffective assistance of counsel claim based on attorney performance[.]” Keller v. State, 308 Ga. 492, 496 (2) (a) (842 SE2d 22) (2020); see also Reid v. State, 286 Ga. 484, 488 (3) (c) (690 SE2d 177) (2010).","The Bradley opinion supports the proposition: in rejecting Bradley's argument that prejudice should be presumed on his ineffective-assistance claim, the court relies on and applies the quoted rule that “this Court has declined to presume prejudice in the context of an ineffective assistance of counsel claim based on attorney performance.” The quoted language appears in the opinion essentially verbatim.

One accuracy note (CLOSE quote check, not a substance problem): within Bradley the sentence is a quotation of Keller v. State, 308 Ga. 492, 496 (2020), and carries an internal bracketed period (“performance[.]”). The brief drops the internal attribution and presents the language as Bradley's own, but Bradley adopts and applies the rule to deny relief, so citing Bradley for the principle is accurate.",claude-opus-4-8/assess-v2
payne-36,27,A crime is considered committed in a citizen's presence if they acquire knowledge of its commission through the exercise of any of their senses; the terms 'in his presence' and 'within his immediate knowledge' are synonymous.,,"Johnson v. Jackson, 140 Ga. App. 252 (1976)",Johnson v. Jackson,,Green,https://www.courtlistener.com/opinion/1217054/johnson-v-jackson/,VERIFIED,,opinions/Johnson_v_Jackson.html,,"[""in his presence"", ""within his immediate knowledge""]","The terms ""in his presence"" and ""within his immediate knowledge"" are synonymous, meaning that a crime is considered to be committed in a citizen's presence if they acquire knowledge of its commission through the exercise of any of their senses. Johnson v. Jackson, 140 Ga. App. 252 (1976), Merneigh v. State, 242 Ga. App. 735 (2000).","[{""quote"": ""in his presence"", ""result"": ""VERBATIM"", ""similarity"": 1.0, ""matched_passage"": ""ty, but \""[a] private person may arrest an offender, if the offense is committed in his presence or within his immediate knowledge; and if the offense is a felony and the offen""}, {""quote"": ""within his immediate knowledge"", ""result"": ""VERBATIM"", ""similarity"": 1.0, ""matched_passage"": ""e person may arrest an offender, if the offense is committed in his presence or within his immediate knowledge; and if the offense is a felony and the offender is escaping, or attempting to""}]",VERBATIM,,,full,,supported,Supported,"The terms ""in his presence"" and ""within his immediate knowledge"" are synonymous, meaning that a crime is considered to be committed in a citizen's presence if they acquire knowledge of its commission through the exercise of any of their senses. Johnson v. Jackson, 140 Ga. App. 252 (1976) [...].","The phrases ""in his presence"" and ""within his immediate knowledge"" are synonymous and a crime is committed in one's presence if by the exercise of any of his senses he has knowledge of its commission.","Johnson v. Jackson directly supports this proposition. At *257 the opinion states, nearly word for word with the brief, that the phrases ""in his presence"" and ""within his immediate knowledge"" are synonymous and that a crime is committed in one's presence if by the exercise of any of one's senses one has knowledge of its commission. The quoted strings appear verbatim in the citizen's-arrest discussion.",claude-opus-4-8/assess-v2
payne-37,27,A crime is considered committed in a citizen's presence if they acquire knowledge of its commission through the exercise of any of their senses; the terms 'in his presence' and 'within his immediate knowledge' are synonymous.,,"Merneigh v. State, 242 Ga. App. 735 (2000)",Merneigh v. State,,Yellow,https://www.courtlistener.com/opinion/1420144/merneigh-v-state/,VERIFIED,,opinions/Merneigh_v_State.html,,"[""in his presence"", ""within his immediate knowledge""]","The terms ""in his presence"" and ""within his immediate knowledge"" are synonymous, meaning that a crime is considered to be committed in a citizen's presence if they acquire knowledge of its commission through the exercise of any of their senses. Johnson v. Jackson, 140 Ga. App. 252 (1976), Merneigh v. State, 242 Ga. App. 735 (2000).","[{""quote"": ""in his presence"", ""result"": ""VERBATIM"", ""similarity"": 1.0, ""matched_passage"": ""\u201cA private person may arrest an offender if the offense is committed in his presence or within his immediate knowledge.\u201d 8 Here, the customer service employee testi""}, {""quote"": ""within his immediate knowledge"", ""result"": ""VERBATIM"", ""similarity"": 1.0, ""matched_passage"": ""te person may arrest an offender if the offense is committed in his presence or within his immediate knowledge.\u201d 8 Here, the customer service employee testified that Merneigh took cigarettes""}]",VERBATIM,,,full,,partial,Overstated -- case partially supports,"The terms ""in his presence"" and ""within his immediate knowledge"" are synonymous, meaning that a crime is considered to be committed in a citizen's presence if they acquire knowledge of its commission through the exercise of any of their senses. Johnson v. Jackson, 140 Ga. App. 252 (1976), Merneigh v. State, 242 Ga. App. 735 (2000).","OCGA § 17-4-60 provides, in pertinent part, that a private citizen may arrest an offender “if the offense is committed in his presence or within his immediate knowledge.” ... The term “within his immediate knowledge” enables a private citizen to use any of his senses to obtain knowledge that an offense is being committed.","Merneigh supports the ""any of their senses"" half of the proposition: the opinion holds that the statutory term ""within his immediate knowledge"" enables a private citizen to use any of his senses to obtain knowledge that an offense is being committed, so a citizen need not actually be present.

But the opinion does not treat ""in his presence"" and ""within his immediate knowledge"" as synonymous; it does the opposite. The court stresses that OCGA § 17-4-60 uses the disjunctive ""or"" (emphasis supplied in the opinion) and applies the two phrases to different actors -- the food manager's authority rested on presence, the store manager's on immediate knowledge. Treating the two terms as synonymous overstates and mischaracterizes the holding, which keeps them as distinct alternatives. The citation is therefore only a partial fit.",claude-opus-4-8/assess-v2
payne-38,27,"For misdemeanors, the offense must occur in the citizen's presence or immediate knowledge, while for felonies, a citizen may also arrest upon reasonable and probable grounds of suspicion if the offender is escaping or attempting to escape.",,"Johnson v. Jackson, 140 Ga. App. 252 (1976)",Johnson v. Jackson,,Green,https://www.courtlistener.com/opinion/1217054/johnson-v-jackson/,VERIFIED,,opinions/Johnson_v_Jackson.html,,[],"For misdemeanors, the offense must occur in the citizen's presence or immediate knowledge, while for felonies, a citizen may also arrest upon reasonable and probable grounds of suspicion if the offender is escaping or attempting to escape. Johnson v. Jackson, 140 Ga. App. 252, Delegal v. State, 109 Ga. 518, 521 (1900), Prayor v. State, 217 Ga. App. 56 (1995).",[],NO_QUOTES,,,fast,,supported,Supported,"For misdemeanors, the offense must occur in the citizen's presence or immediate knowledge, while for felonies, a citizen may also arrest upon reasonable and probable grounds of suspicion if the offender is escaping or attempting to escape. Johnson v. Jackson, 140 Ga. App. 252 [...].","[A] private person may arrest an offender, if the offense is committed in his presence or within his immediate knowledge; and if the offense is a felony and the offender is escaping, or attempting to escape, a private person may arrest him upon reasonable and probable grounds of suspicion.","Johnson v. Jackson supports this proposition. At *257 the opinion quotes Code Sec. 27-211, which draws exactly the distinction the brief states: an offense must be committed in the citizen's presence or within his immediate knowledge to support an arrest, and where the offense is a felony and the offender is escaping or attempting to escape, the citizen may arrest upon reasonable and probable grounds of suspicion.",claude-opus-4-8/assess-v2
payne-39,28,"For misdemeanors, the offense must occur in the citizen's presence or immediate knowledge, while for felonies, a citizen may also arrest upon reasonable and probable grounds of suspicion if the offender is escaping or attempting to escape.",,"Delegal v. State, 109 Ga. 518, 521 (1900)",Delegal v. State,,Green,https://www.courtlistener.com/opinion/5719482/delegal-v-state/,VERIFIED,,opinions/Delegal_v_State.html,,[],"For misdemeanors, the offense must occur in the citizen's presence or immediate knowledge, while for felonies, a citizen may also arrest upon reasonable and probable grounds of suspicion if the offender is escaping or attempting to escape. Johnson v. Jackson, 140 Ga. App. 252, Delegal v. State, 109 Ga. 518, 521 (1900), Prayor v. State, 217 Ga. App. 56 (1995).",[],NO_QUOTES,,,fast,,supported,Supported,"For misdemeanors, the offense must occur in the citizen's presence or immediate knowledge, while for felonies, a citizen may also arrest upon reasonable and probable grounds of suspicion if the offender is escaping or attempting to escape. Johnson v. Jackson, 140 Ga. App. 252, Delegal v. State, 109 Ga. 518, 521 (1900), Prayor v. State, 217 Ga. App. 56 (1995).","It is a well-settled principle of the law of this State, and, as far as we are advised, of all other jurisdictions, that a private individual can not make an arrest for a misdemeanor, unless the offense is committed in his presence or within his immediate knowledge. Our Penal Code, § 900, declares that “A private person may arrest an offender if the offense is committed in his presence or within his immediate knowledge; and if the offense is a felony, and the offender is escaping, or attempting to escape, a private person may arrest him upon reasonable and probable grounds of suspicion.”","Delegal v. State directly supports the proposition. The opinion, quoting Penal Code § 900, states that a private person may arrest for any offense committed in his presence or within his immediate knowledge, and that for a felony where the offender is escaping or attempting to escape, a private person may arrest upon reasonable and probable grounds of suspicion. The court further articulates the misdemeanor limitation as a well-settled principle: a private individual cannot arrest for a misdemeanor unless the offense was committed in his presence or within his immediate knowledge. The brief's statement of the misdemeanor-versus-felony distinction tracks the cited case accurately.",claude-opus-4-8/assess-v2
payne-40,28,"For misdemeanors, the offense must occur in the citizen's presence or immediate knowledge, while for felonies, a citizen may also arrest upon reasonable and probable grounds of suspicion if the offender is escaping or attempting to escape.",,"Prayor v. State, 217 Ga. App. 56 (1995)",Prayor v. State,,Yellow,https://www.courtlistener.com/opinion/1253106/prayor-v-state/,VERIFIED,,opinions/Prayor_v_State.html,,[],"For misdemeanors, the offense must occur in the citizen's presence or immediate knowledge, while for felonies, a citizen may also arrest upon reasonable and probable grounds of suspicion if the offender is escaping or attempting to escape. Johnson v. Jackson, 140 Ga. App. 252, Delegal v. State, 109 Ga. 518, 521 (1900), Prayor v. State, 217 Ga. App. 56 (1995).",[],NO_QUOTES,,,fast,,partial,Overstated -- case partially supports,"For misdemeanors, the offense must occur in the citizen's presence or immediate knowledge, while for felonies, a citizen may also arrest upon reasonable and probable grounds of suspicion if the offender is escaping or attempting to escape. [...] Prayor v. State, 217 Ga. App. 56 (1995).",OCGA § 17-4-60 provides that a private citizen may make an arrest if a felony is committed in his presence or within his immediate knowledge. A private citizen may make an arrest upon reasonable and probable grounds of suspicion if the offense is a felony and the offender is escaping or trying to escape.,"Prayor (quoting Hayes v. State) supports the felony half of this proposition: a citizen may arrest if a felony is committed in his presence or immediate knowledge, and may also arrest on reasonable and probable grounds of suspicion when the offense is a felony and the offender is escaping. But the opinion's statement of OCGA § 17-4-60 is entirely about felonies. It says nothing about misdemeanors or any 'presence or immediate knowledge' requirement specific to misdemeanors. The brief grafts a misdemeanor rule onto a passage that does not contain one, so the citation only partially supports the stated proposition.",claude-opus-4-8/assess-v2
