claim_id,page,proposition,cited_for,cited_case,retrieved_case,supporting_language,assessment,cl_url,cl_status,diagnostics,opinion_file,syllabus,quoted_text,brief_sentence,quote_check,quote_check_worst,quote_floor,crosscheck_flags,triage_track,prescreen_hint,support,badge_label,brief_block,opinion_block,finding_analysis,assessed_by
payne-53,30,"The use of force is not justified if the individual was the initial aggressor, unless they withdraw from the encounter and effectively communicate their intent to do so and the other party continues or threatens to continue the use of unlawful force.",,"Wainwright v. State, 305 Ga. 63 (2019)",Wainwright v. State,,Green,https://www.courtlistener.com/opinion/7479307/wainwright-v-state/,VERIFIED,,opinions/Wainwright_v_State.html,,[],"Additionally, the use of force is not justified if the individual was the initial aggressor, unless they withdraw from the encounter and effectively communicate their intent to do so, and the other party continues or threatens to continue the use of unlawful force OCGA § 16-3-21, Wainwright v. State, 305 Ga. 63 (2019), Powers v. State, 297 Ga. 345 (2015).",[],NO_QUOTES,,,fast,,supported,Supported,"Additionally, the use of force is not justified if the individual was the initial aggressor, unless they withdraw from the encounter and effectively communicate their intent to do so, and the other party continues or threatens to continue the use of unlawful force OCGA § 16-3-21, Wainwright v. State, 305 Ga. 63 (2019), Powers v. State, 297 Ga. 345 (2015).","(3) Was the aggressor or was engaged in combat by agreement unless he withdraws from the encounter and effectively communicates to such other person his intent to do so and the other, notwithstanding, continues or threatens to continue the use of unlawful force.","Wainwright v. State quotes OCGA § 16-3-21 (b)(3) verbatim and relies on it to deny the justification charge, so the brief's proposition that an initial aggressor is not justified unless he withdraws, effectively communicates his intent to do so, and the other party continues or threatens to continue unlawful force tracks the rule the opinion actually applies. The brief's language is a close paraphrase of the statutory text the opinion sets out, and the case is correctly cited for that aggressor-withdrawal rule.",claude-opus-4-8/assess-v2
payne-54,31,"The use of force is not justified if the individual was the initial aggressor, unless they withdraw from the encounter and effectively communicate their intent to do so and the other party continues or threatens to continue the use of unlawful force.",,"Powers v. State, 297 Ga. 345 (2015)",Powers v. State,,Green,https://www.courtlistener.com/opinion/2808301/powers-v-state/,VERIFIED,,opinions/Powers_v_State.html,,[],"Additionally, the use of force is not justified if the individual was the initial aggressor, unless they withdraw from the encounter and effectively communicate their intent to do so, and the other party continues or threatens to continue the use of unlawful force OCGA § 16-3-21, Wainwright v. State, 305 Ga. 63 (2019), Powers v. State, 297 Ga. 345 (2015).",[],NO_QUOTES,,,fast,,supported,Supported,"Additionally, the use of force is not justified if the individual was the initial aggressor, unless they withdraw from the encounter and effectively communicate their intent to do so, and the other party continues or threatens to continue the use of unlawful force OCGA § 16-3-21, Wainwright v. State, 305 Ga. 63 (2019), Powers v. State, 297 Ga. 345 (2015).","And a defendant is not entitled to a jury instruction on justification when the evidence is that the supposedly justified party was the aggressor. See OCGA § 16-3-21 (b) (3) (“A person is not justified in using force . . . if he . . . [w]as the aggressor ... unless he withdraws from the encounter and effectively communicates to such other person his intent to do so and the other, notwithstanding, continues or threatens to continue the use of unlawful force.”)","Powers v. State supports the proposition. The opinion expressly quotes and applies OCGA § 16-3-21 (b) (3), holding that “a defendant is not entitled to a jury instruction on justification when the evidence is that the supposedly justified party was the aggressor,” and reciting the statute's withdrawal-and-communication exception in language that tracks the brief's proposition.",claude-opus-4-8/assess-v2
payne-55,31,A jury charge on citizen's arrest was not warranted because there was no evidence that the defendant was attempting to effectuate an arrest and the defendant used more force than was reasonable under the circumstances.,,"Patel v. State, 279 Ga. 50",Smith v. State,,,https://www.courtlistener.com/opinion/1256046/smith-v-state/,WRONG_CASE,no party-overlap across cluster/docket/opinion sources,opinions/Smith_v_State.html,,[],"The Court held in Patel v. State, 279 Ga. 50, that a jury charge on citizen's arrest was not warranted because there was no evidence that the defendant was attempting to effectuate an arrest, and the defendant used more force than was reasonable under the circumstances.",[],NO_QUOTES,,"{""toa_mismatch"": {""variants"": [""Patel v. State, 279 Ga. 750"", ""Patel v. State, 279 Ga. 50""]}}",,,,,,,,
payne-56,31,"A defendant is not entitled to a jury instruction on justification, including in the context of a citizen's arrest, when the evidence shows that the defendant was the aggressor.",,"Wainwright v. State, 305 Ga. 63",Wainwright v. State,,Yellow,https://www.courtlistener.com/opinion/7479307/wainwright-v-state/,VERIFIED,,opinions/Wainwright_v_State.html,,[],"Similarly, in Wainwright v. State, 305 Ga. 63, the Court determined that a defendant is not entitled to a jury instruction on justification, including in the context of a citizen's arrest, when the evidence shows that the defendant was the aggressor.",[],NO_QUOTES,,,fast,,partial,Overstated -- case partially supports,"Similarly, in Wainwright v. State, 305 Ga. 63, the Court determined that a defendant is not entitled to a jury instruction on justification, including in the context of a citizen's arrest, when the evidence shows that the defendant was the aggressor.","Here, the evidence shows Wainwright initiated the assault and robbery of the victims by aggressively approaching Arnold and pointing a gun in his face before demanding Sanusi to empty his pockets at gunpoint. Under these circumstances, Wainwright was not entitled to a jury charge on justification.","The core of the proposition is supported: Wainwright holds that because the defendant initiated the assault and robbery, he was not entitled to a jury charge on justification, quoting Powers for the rule that a defendant is not entitled to a justification instruction when the evidence is that the supposedly justified party was the aggressor.

The overstatement is the qualifier ""including in the context of a citizen's arrest."" The Wainwright opinion does not mention citizen's arrest anywhere; its justification analysis concerns self-defense and defense of others under OCGA § 16-3-21, not citizen's arrest. The aggressor-no-justification holding is accurate, but the brief extends it to a citizen's-arrest context the case never addresses.",claude-opus-4-8/assess-v2
payne-57,31,"A jury charge on a defendant's sole defense is only required if there is some evidence to support the charge, and even slight evidence is sufficient, but there must be a legitimate basis for the defense.",,"Tarvestad v. State, 261 Ga. 605",Tarvestad v. State,,Yellow,https://www.courtlistener.com/opinion/1409138/tarvestad-v-state/,VERIFIED,,opinions/Tarvestad_v_State.html,,"[""but there must be a legitimate basis for the defense.""]","Even slight evidence is sufficient to warrant such a charge, but there must be a legitimate basis for the defense. (Emphasis added) Tarvestad v. State, 261 Ga. 605, Virgil v. State, 227 Ga. App. 96.","[{""quote"": ""but there must be a legitimate basis for the defense."", ""result"": ""FABRICATED"", ""similarity"": 0.47, ""matched_passage"": ""at a review of all of the evidence showed that Tarvestad had options other than driving the truck. The trial court must charge the jury on the defendant\u2019s sole defense, even without a written request, if there is some evidence to support t""}]",FABRICATED,Yellow,,full,,partial,Overstated -- case partially supports,"Even slight evidence is sufficient to warrant such a charge, but there must be a legitimate basis for the defense. (Emphasis added) Tarvestad v. State, 261 Ga. 605, Virgil v. State, 227 Ga. App. 96.","The trial court must charge the jury on the defendant's sole defense, even without a written request, if there is some evidence to support the charge.","Tarvestad squarely supports the core of the proposition: the opinion holds that the trial court must charge the jury on the defendant's sole defense, even without a written request, if there is some evidence to support the charge. That ""some evidence"" standard is the holding's centerpiece.

The brief, however, layers on two qualifiers the opinion does not state. Tarvestad contains no ""even slight evidence is sufficient"" formulation, and it nowhere requires that ""there must be a legitimate basis for the defense"" -- the quoted phrase does not appear in the opinion (consistent with the FABRICATED quote-check result). Those glosses may come from the companion citation, but as attributed to Tarvestad they overstate what this case decided, so the support is partial rather than full.",claude-opus-4-8/assess-v2
payne-58,31,"A jury charge on a defendant's sole defense is only required if there is some evidence to support the charge, and even slight evidence is sufficient, but there must be a legitimate basis for the defense.",,"Virgil v. State, 227 Ga. App. 96",Virgil v. State,,Yellow,https://www.courtlistener.com/opinion/5793070/virgil-v-state/,VERIFIED,,opinions/Virgil_v_State.html,,"[""but there must be a legitimate basis for the defense.""]","Even slight evidence is sufficient to warrant such a charge, but there must be a legitimate basis for the defense. (Emphasis added) Tarvestad v. State, 261 Ga. 605, Virgil v. State, 227 Ga. App. 96.","[{""quote"": ""but there must be a legitimate basis for the defense."", ""result"": ""FABRICATED"", ""similarity"": 0.5, ""matched_passage"": ""2. As to Virgil\u2019s contention that the trial court erred by refusing to give her requested charge on the defense of accident, we find no basis for a charge on the defense of accident under th""}]",FABRICATED,Yellow,,full,,partial,Overstated -- case partially supports,"Even slight evidence is sufficient to warrant such a charge, but there must be a legitimate basis for the defense. (Emphasis added) Tarvestad v. State, 261 Ga. 605, Virgil v. State, 227 Ga. App. 96.","As to Virgil's contention that the trial court erred by refusing to give her requested charge on the defense of accident, we find no basis for a charge on the defense of accident under the facts of this case.","Virgil v. State is a DUI case in which the defendant argued the trial court erred by refusing to charge the jury on the defense of accident. The opinion supports the general notion that a charge on a defense requires a legitimate basis in the facts -- the court found ""no basis for a charge on the defense of accident under the facts of this case"" because Virgil did not actually claim any contested element of the offense was done by accident, but only that she was not driving or in actual physical control of the car.

The opinion does not, however, articulate the brief's specific standard that ""even slight evidence is sufficient"" to warrant such a charge. The quoted phrase ""but there must be a legitimate basis for the defense"" does not appear in the opinion (the quote check flags it as FABRICATED). The case is thus topically aligned with the legitimate-basis half of the proposition but does not state the slight-evidence rule the brief attributes to it, so the support is partial rather than full.",claude-opus-4-8/assess-v2
payne-59,31,A citizen who uses excessive force loses the protection of the citizen's arrest statute and cannot rely on the statute as a defense against criminal or civil claims.,,"Prayor v. State, 217 Ga. App. 56",Prayor v. State,,Yellow,https://www.courtlistener.com/opinion/1253106/prayor-v-state/,VERIFIED,,opinions/Prayor_v_State.html,,[],"A citizen who uses excessive force loses the protection of the citizen's arrest statute. This means that the arrest is no longer considered lawful, and the individual cannot rely on the statute as a defense against criminal or civil claims. Prayor v. State, 217 Ga. App. 56, Patel v. State, 279 Ga. 750.",[],NO_QUOTES,,,fast,,partial,Overstated -- case partially supports,"A citizen who uses excessive force loses the protection of the citizen's arrest statute. This means that the arrest is no longer considered lawful, and the individual cannot rely on the statute as a defense against criminal or civil claims. Prayor v. State, 217 Ga. App. 56, Patel v. State, 279 Ga. 750.",under the evidence adduced at trial the jury was authorized to reject his citizen's arrest/justification and self-defense/justification defenses and to convict him of the crime charged.,"Prayor supports the general thrust of this proposition but not its specific framing. The opinion establishes that a valid citizen's arrest permits no more than reasonable force, and it holds that the jury was authorized to reject the defendant's citizen's-arrest justification defense and convict him -- which is consistent with the idea that excessive force defeats the defense. But the opinion does not state the principle that excessive force 'loses the protection of the statute,' and it is a criminal aggravated-assault appeal that says nothing about civil claims. The citation reasonably supports the criminal-defense point in a general way but overstates by adding the loss-of-statutory-protection framing and the civil-claims extension, neither of which appears in Prayor.",claude-opus-4-8/assess-v2
payne-60,31,A citizen who uses excessive force loses the protection of the citizen's arrest statute and cannot rely on the statute as a defense against criminal or civil claims.,,"Patel v. State, 279 Ga. 750",Patel v. State,,Yellow,https://www.courtlistener.com/opinion/1245424/patel-v-state/,VERIFIED,,opinions/Patel_v_State.html,,[],"A citizen who uses excessive force loses the protection of the citizen's arrest statute. This means that the arrest is no longer considered lawful, and the individual cannot rely on the statute as a defense against criminal or civil claims. Prayor v. State, 217 Ga. App. 56, Patel v. State, 279 Ga. 750.",[],NO_QUOTES,,"{""toa_mismatch"": {""variants"": [""Patel v. State, 279 Ga. 750"", ""Patel v. State, 279 Ga. 50""]}}",full,,partial,Overstated -- case partially supports,"A citizen who uses excessive force loses the protection of the citizen's arrest statute. This means that the arrest is no longer considered lawful, and the individual cannot rely on the statute as a defense against criminal or civil claims. [...] Patel v. State, 279 Ga. 750.","“... the use of unreasonable force . . . could not have been part of a legitimate citizen’s arrest.” Here, Patel did not attempt to restrain the victim; rather, he shot and killed him minutes after commanding him to halt.","Patel v. State supports the core idea that unreasonable force takes conduct outside the protection of the citizen's-arrest statute: it quotes Carter v. State that “the use of unreasonable force . . . could not have been part of a legitimate citizen’s arrest” and applies that to hold that Patel’s shooting could not be a lawful citizen's arrest.

The brief overstates by framing the case as a rule that the citizen “cannot rely on the statute as a defense against criminal or civil claims.” Patel is a criminal felony-murder/ineffective-assistance decision; it holds only that the evidence did not support a citizen's-arrest jury charge, and it says nothing about civil claims. The proposition is topically grounded but extends the holding to a defense-availability rule the opinion does not articulate.",claude-opus-4-8/assess-v2
payne-61,31,"Deadly force in effecting an arrest is limited to self-defense or preventing a forcible felony, and any use of force beyond what is reasonable invalidates the arrest.",,"Prayor v. State, 217 Ga. App. 56",Prayor v. State,,Yellow,https://www.courtlistener.com/opinion/1253106/prayor-v-state/,VERIFIED,,opinions/Prayor_v_State.html,,[],"The Court reiterated in Prayor that deadly force in effecting an arrest is limited to self-defense or preventing a forcible felony, and any use of force beyond what is reasonable invalidates the arrest. Prayor v. State, 217 Ga. App. 56.",[],NO_QUOTES,,,fast,,partial,Overstated -- case partially supports,"The Court reiterated in Prayor that deadly force in effecting an arrest is limited to self-defense or preventing a forcible felony, and any use of force beyond what is reasonable invalidates the arrest. Prayor v. State, 217 Ga. App. 56.","For a citizen's arrest to be valid, the citizen must use no more force than is reasonable under the circumstances. . . . Also, . . . deadly force in effecting an arrest is limited to self-defense or to a situation in which it is necessary to prevent a forcible felony.","The deadly-force half of this proposition is fully supported: Prayor (quoting Hayes) states that deadly force in effecting an arrest is limited to self-defense or to preventing a forcible felony. The second clause overstates slightly. The opinion says a valid citizen's arrest requires 'no more force than is reasonable under the circumstances,' but it does not frame excess force as something that 'invalidates the arrest.' That is a reasonable but unstated extension of the opinion's reasonable-force requirement, so the citation partially supports the proposition.",claude-opus-4-8/assess-v2
payne-62,32,"Deadly force is strictly limited to lawful self-defense or prevention of a forcible felony, and its use is always subject to judicial scrutiny and jury determination.",,"Johnson v. Jackson, 140 Ga. App. 252",Johnson v. Jackson,,Yellow,https://www.courtlistener.com/opinion/1217054/johnson-v-jackson/,VERIFIED,,opinions/Johnson_v_Jackson.html,,[],"Deadly force is strictly limited to lawful self-defense or prevention of a forcible felony, and its use is always subject to judicial scrutiny and jury determination. Johnson v. Jackson, 140 Ga. App. 252; Merneigh v. State, 242 Ga. App. 735; Prayor v. State, 217 Ga. App. 56; OCGA § 16-3-21.",[],NO_QUOTES,,,fast,,partial,Overstated -- case partially supports,"Deadly force is strictly limited to lawful self-defense or prevention of a forcible felony, and its use is always subject to judicial scrutiny and jury determination. Johnson v. Jackson, 140 Ga. App. 252 [...].",The use of force which is intended or likely to cause death or great bodily harm to prevent trespass on or other tortious or criminal interference with real property (other than a habitation) or personal property is not justified unless the person using such force reasonably believes that it is necessary to prevent the commission of a forcible felony.,"Johnson v. Jackson supports the core of this proposition but the brief overstates it. The opinion ties the use of deadly force to prevention of a forcible felony (quoting Criminal Code Sec. 26-904(b)) and repeatedly holds that whether the force used was reasonable and whether the killing was necessary are questions for the jury, so the jury-determination point is squarely grounded. But the case does not state, as a categorical rule, that deadly force is ""strictly limited to lawful self-defense or prevention of a forcible felony""; self-defense is not a focus, and the opinion also recognizes a citizen's authority to use force in effecting a felony arrest. The proposition is topically on point and the holding extends to most of it, but the ""strictly limited to lawful self-defense"" framing reaches beyond what the case decided.",claude-opus-4-8/assess-v2
payne-63,32,"Deadly force is strictly limited to lawful self-defense or prevention of a forcible felony, and its use is always subject to judicial scrutiny and jury determination.",,"Merneigh v. State, 242 Ga. App. 735",Merneigh v. State,,Red,https://www.courtlistener.com/opinion/1420144/merneigh-v-state/,VERIFIED,,opinions/Merneigh_v_State.html,,[],"Deadly force is strictly limited to lawful self-defense or prevention of a forcible felony, and its use is always subject to judicial scrutiny and jury determination. Johnson v. Jackson, 140 Ga. App. 252; Merneigh v. State, 242 Ga. App. 735; Prayor v. State, 217 Ga. App. 56; OCGA § 16-3-21.",[],NO_QUOTES,,,fast,,unsupported,Case on unrelated subject,"Deadly force is strictly limited to lawful self-defense or prevention of a forcible felony, and its use is always subject to judicial scrutiny and jury determination. Johnson v. Jackson, 140 Ga. App. 252; Merneigh v. State, 242 Ga. App. 735; Prayor v. State, 217 Ga. App. 56; OCGA § 16-3-21.",,"Merneigh v. State is a criminal appeal about theft by shoplifting and aggravated assault, addressing the sufficiency of an indictment, jury instructions, citizen's-arrest authority under OCGA § 17-4-60, a lesser-included reckless-conduct charge, juror strikes for cause, and use of an alias in the indictment. It does not address the proposition that deadly force is strictly limited to lawful self-defense or prevention of a forcible felony, nor that its use is always subject to judicial scrutiny and jury determination.

The opinion's only brush with self-defense is Division 5, where the court held the trial court properly refused justification and self-defense charges because no evidence supported them -- a record-specific ruling, not a statement of any limit on deadly force. Nothing in the opinion announces the cited principle, so the case does not support the proposition.",claude-opus-4-8/assess-v2
payne-64,32,"Deadly force is strictly limited to lawful self-defense or prevention of a forcible felony, and its use is always subject to judicial scrutiny and jury determination.",,"Prayor v. State, 217 Ga. App. 56",Prayor v. State,,Yellow,https://www.courtlistener.com/opinion/1253106/prayor-v-state/,VERIFIED,,opinions/Prayor_v_State.html,,[],"Deadly force is strictly limited to lawful self-defense or prevention of a forcible felony, and its use is always subject to judicial scrutiny and jury determination. Johnson v. Jackson, 140 Ga. App. 252; Merneigh v. State, 242 Ga. App. 735; Prayor v. State, 217 Ga. App. 56; OCGA § 16-3-21.",[],NO_QUOTES,,,fast,,partial,Overstated -- case partially supports,"Deadly force is strictly limited to lawful self-defense or prevention of a forcible felony, and its use is always subject to judicial scrutiny and jury determination. Johnson v. Jackson, 140 Ga. App. 252; Merneigh v. State, 242 Ga. App. 735; Prayor v. State, 217 Ga. App. 56; OCGA § 16-3-21.",deadly force in effecting an arrest is limited to self-defense or to a situation in which it is necessary to prevent a forcible felony.,"The core deadly-force limitation -- confined to self-defense or prevention of a forcible felony -- is directly supported by Prayor's quotation of the Hayes rule. The added assertion that deadly force is 'always subject to judicial scrutiny and jury determination' is only loosely grounded: Prayor does illustrate a jury rejecting the citizen's-arrest and self-defense justifications and convicting (section 2), but the opinion does not announce any general rule that deadly force is 'always' subject to judicial scrutiny and jury determination. The citation supports the deadly-force limit and is consistent with jury determination on the facts, but the categorical 'always' framing extends beyond what the opinion holds, making this partial.",claude-opus-4-8/assess-v2
payne-65,32,"When a defendant is the initial aggressor and the evidence does not support the statutory elements of a lawful citizen's arrest, the trial court is not required to instruct the jury on citizen's arrest.",,"Wainwright v. State, 305 Ga. 63",Wainwright v. State,,Red,https://www.courtlistener.com/opinion/7479307/wainwright-v-state/,VERIFIED,,opinions/Wainwright_v_State.html,,[],"Further, when a defendant is the initial aggressor and the evidence does not support the statutory elements of a lawful citizen's arrest, the trial court is not required to instruct the jury on citizen's arrest. Wainwright v. State, 305 Ga. 63; Patel v. State, 279 Ga. 750; Virgil v. State, 227 Ga. App. 96.",[],NO_QUOTES,,,fast,,unsupported,Not supported by cited case,"Further, when a defendant is the initial aggressor and the evidence does not support the statutory elements of a lawful citizen's arrest, the trial court is not required to instruct the jury on citizen's arrest. Wainwright v. State, 305 Ga. 63; Patel v. State, 279 Ga. 750; Virgil v. State, 227 Ga. App. 96.",,"Wainwright v. State does not address citizen's arrest at all. The opinion's justification discussion (Division 5(b)) is confined to self-defense and defense of others under OCGA § 16-3-21; it never mentions a citizen's-arrest instruction, the statutory elements of a lawful citizen's arrest, or any rule about when such an instruction is required.

The proposition attributes a citizen's-arrest-specific holding -- that no citizen's-arrest charge is required where the aggressor's evidence does not satisfy the statutory elements -- to a case that contains no such principle. The shared ""initial aggressor"" vocabulary does not bridge the gap, because the brief's proposition turns on a distinct legal issue (the citizen's-arrest instruction and its elements) that Wainwright simply does not decide.",claude-opus-4-8/assess-v2
