citing_cluster,citation_string,cited_case_name,cited_year,docket_id,docket_url,court_id,lookup_method,n_candidate_docs,best_doc_id,best_description,is_available,is_free_on_pacer,page_count,has_plain_text,ocr_status,subreason,subreason_detail
10845114,2024 WL 3446824,ra dias deapocalypse bey v. Clapprood,2024,66969331,https://www.courtlistener.com/docket/66969331/43/dias-deapocalypse-bey-v-clapprood/,mad,entry_number=43,1,388922997,Memorandum & Order,False,False,,False,,recap_doc_unavailable,no available recap_document on this entry (is_available=false). PACER has the doc but CL hasn't received a RECAP upload of it.
10802819,2016 WL 5957681,"Mehar Holdings, LLC v. Evanston Ins. Co.",2016,5474769,https://www.courtlistener.com/docket/5474769/19/mehar-holdings-llc-v-evanston-insurance-company/,txwd,entry_number=19,1,18720567,ORDER GRANTING 14 Motion for Reconsideration re 13 Order. The Court GRANTS 4 Motion to Remand. Signed by Judge David A. Ezra. (rf) (Entered: 10/14/2016),True,True,12,True,2,recap_doc_opinion_not_ingested,"available opinion-typed doc with text exists on CL, but no opinion cluster was ingested: ""ORDER GRANTING 14 Motion for Reconsideration re 13 Order. The Court GRANTS 4 Motion to Remand. Signed by Judge David A. """
10802819,2020 WL 1969530,Hazari LLC v. Everest Indem. Ins. Co.,2020,16348672,https://www.courtlistener.com/docket/16348672/26/hazari-llc-dba-stay-express-inn-suites-v-everest-indemnity-insurance/,txsd,entry_number=26,1,130466485,Order on Motion to Remand,False,False,,False,,recap_doc_unavailable,no available recap_document on this entry (is_available=false). PACER has the doc but CL hasn't received a RECAP upload of it.
10770725,"2015 WL 13648107, *1",Cabot v. Lewis,2015,4275225,https://www.courtlistener.com/docket/4275225/174/cabot-v-lewis/,mad,entry_number=174,1,5338694,"Judge F. Dennis Saylor, IV: ORDER CERTIFYING INTERLOCUTORY APPEAL entered. (Pezzarossi, Lisa) (Entered: 07/09/2015)",True,True,4,True,2,recap_doc_not_opinion_typed,"available doc with text but description doesn't match opinion-typing patterns: ""Judge F. Dennis Saylor, IV: ORDER CERTIFYING INTERLOCUTORY APPEAL entered. (Pezzarossi, Lisa) (Entered: 07/09/2015)"""
10770795,2013 WL 6088409,Hunter v. City & Cnty. of San Francisco,2013,5929390,https://www.courtlistener.com/docket/5929390/232/hunter-v-city-and-county-of-san-francisco/,cand,entry_number=232,1,20032027,"ORDER RE: PLAINTIFFS MOTION FOR REVIEW OF CLERKS TAXATION OF COSTS (Dkt. No. 219. Signed  by Magistrate Judge Jacqueline Scott Corley.  (ahm, COURT STAFF) (Filed on 11/19/2013)",True,True,8,True,2,recap_doc_not_opinion_typed,"available doc with text but description doesn't match opinion-typing patterns: ""ORDER RE: PLAINTIFFS MOTION FOR REVIEW OF CLERKS TAXATION OF COSTS (Dkt. No. 219. Signed  by Magistrate Judge Jacqueline"""
10810840,2025 WL 2808055,Doe v. Lawrence Gen. Hosp.,2025,69539673,https://www.courtlistener.com/docket/69539673/doe-v-lawrence-general-hospital/,mad,date_filed__year=2025 (filtered to available),1,454203499,Memorandum & Order,True,True,2,True,2,recap_doc_opinion_not_ingested,"available opinion-typed doc with text exists on CL, but no opinion cluster was ingested: ""Memorandum & Order"""
10770795,2009 WL 2392094,Darensburg v. Metro. Transp. Comm'n,,4182878,https://www.courtlistener.com/docket/4182878/452/darensburg-v-metropolitan-transportation-commission/,cand,entry_number=452,1,13644995,"OPINION ON DEFENDANT'S MOTION FOR ATTORNEYS' FEES. Signed by Magistrate Judge Elizabeth D. Laporte on July 7, 2009. (edllc2, COURT STAFF) (Filed on 7/7/2009) (Entered: 07/07/2009)",True,True,10,True,2,recap_doc_opinion_not_ingested,"available opinion-typed doc with text exists on CL, but no opinion cluster was ingested: ""OPINION ON DEFENDANT'S MOTION FOR ATTORNEYS' FEES. Signed by Magistrate Judge Elizabeth D. Laporte on July 7, 2009. (edl"""
