source_court,system,level,tier_label,cited_court_id,cited_case_name,cited_year,citation_text,parenthetical,citing_cluster_id,citing_case,citing_date,citing_court,v1_v_status,v1_v_url,v1_v_matched_name
ilnd,federal,colr,SCOTUS,scotus,F.D.I.C. v. Meyer,1994,510 U.S. 471,actions for money damages against the United States or its agencies generally are barred by sovereign immunity,10847978,"Louise Davenport v. Frank Bisignano, Commissioner of Social Security",2026-03-19,ilnd,VERIFIED,https://www.courtlistener.com/opinion/112931/federal-deposit-insurance-v-meyer/,Federal Deposit Insurance v. Meyer
ilnd,federal,iac,Circuit,ca7,Slabon v. Berryhill,2019,751 F. App’x 928,noting that Congress has already provided a comprehensive benefits-appeal scheme under the Social Security Act,10847978,"Louise Davenport v. Frank Bisignano, Commissioner of Social Security",2026-03-19,ilnd,NOT_FOUND,,
ilnd,federal,iac,Circuit,ca7,"Ctr. v. BP Prods. North America, Inc.",2012,599 F.3d 720,"explaining that while the presumption is rebuttable, “it should not be lightly abandoned, as it is based on a legitimate and substantial concern with minimizing federal intrusion into areas of purely state law”",10847537,"Michael Moore v. Thomas Dart, et al.",2026-03-19,ilnd,VERIFIED,https://www.courtlistener.com/opinion/685/als-service-center-v-bp-products-north-america-inc/,"Al's Service Center v. Bp Products North America, Inc."
ilnd,federal,iac,Circuit,ca7,Tolefree v. Cudahy,1995,49 F.3d 1243,noting that it is self-contradictory to grant leave to appeal in forma pauperis when the same complaint was dismissed for being frivolous,10846556,"Nathaniel McCray v. Charles Truitt, Warden, Stateville Correctional Center",2026-03-18,ilnd,VERIFIED,https://www.courtlistener.com/opinion/691352/jarvis-lee-tolefree-v-richard-d-cudahy/,Jarvis Lee Tolefree v. Richard D. Cudahy
ilnd,federal,colr,SCOTUS,scotus,Neitzke v. Williams,1989,490 U.S. 319,holding that screening of in forma pauperis complaint under Rule 12(b)(6) standard should not be conflated with standard for frivolousness,10846556,"Nathaniel McCray v. Charles Truitt, Warden, Stateville Correctional Center",2026-03-18,ilnd,VERIFIED,https://www.courtlistener.com/opinion/112254/neitzke-v-williams/,Neitzke v. Williams
ilnd,federal,iac,Circuit,ca7,Helmstetter,2022,44 F.4th 676,“Standing is lacking if it is merely ‘speculative’—as opposed to ‘likely’—that the plaintiff's injury would be redressed by a favorable decision.”,10845844,"Dimpleben Kothari, et al. v. Director, U.S. Citizenship and Immigration Services",2026-03-17,ilnd,VERIFIED,https://www.courtlistener.com/opinion/7856102/michael-helmstetter-v-david-herzog/,Michael Helmstetter v. David Herzog
ilnd,federal,iac,Circuit,ca7,Baysal v. Midvale Indem. Co.,2023,78 F.4th 976,“[W]e have held that worry and anxiety are not the kind of concrete injury essential to standing.”,10845844,"Dimpleben Kothari, et al. v. Director, U.S. Citizenship and Immigration Services",2026-03-17,ilnd,VERIFIED,https://www.courtlistener.com/opinion/9421901/alp-baysal-v-midvale-indemnity-company/,Alp Baysal v. Midvale Indemnity Company
ilnd,federal,iac,Circuit,ca10,Campbell v. Bowen,1987,822 F.2d 1518,“An administrative law judge may not ask a vocational expert a hypothetical question based on substantial evidence and then ignore unfavorable answers.”,10845820,"Kajuan M. v. Frank J. Bisignano, Commissioner of Social Security",2026-03-17,ilnd,VERIFIED,https://www.courtlistener.com/opinion/490942/william-r-campbell-plaintiff-appellant-v-otis-bowen-secretary-of-the/,"William R. CAMPBELL, Plaintiff-Appellant, v. Otis BOWEN, Secretary of the Department of Health & Human Services, Defendant-Appellee"
ilnd,federal,iac,Circuit,ca7,Golembiewski v. Barnhart,2003,322 F.3d 912,"“Having found that one or more of Golembiewski's impairments was “severe,” the ALJ needed to consider the aggregate effect of this entire constellation of ailments– including those impairments that in isolation are not severe.”",10845820,"Kajuan M. v. Frank J. Bisignano, Commissioner of Social Security",2026-03-17,ilnd,VERIFIED,https://www.courtlistener.com/opinion/781230/michael-e-golembiewski-v-jo-anne-b-barnhart-commissioner-of-social/,"Michael E. Golembiewski v. Jo Anne B. Barnhart, Commissioner of Social Security"
mad,federal,colr,SCOTUS,scotus,Hippocratic Med.,2024,602 U.S. 367,“Article III requires a plaintiff to first answer a basic question: ‘What’s it to you?’”,10850794,John Igo v. Clerk of the United States District Court for Massachusetts,2026-04-06,mad,VERIFIED,https://www.courtlistener.com/opinion/10600082/fda-v-alliance-for-hippocratic-medicine/,FDA v. Alliance for Hippocratic Medicine
mad,federal,colr,SCOTUS,scotus,"Goldlawr, Inc. v. Heiman",1962,369 U.S. 463,holding that the language of section 1406(a) is “amply broad enough to authorize the transfer of cases” when the district court in which the plaintiff filed the case lacks personal jurisdiction over the defendant.,10850751,Parikshit Gaikwad v. Amber Hanson,2026-04-06,mad,VERIFIED,https://www.courtlistener.com/opinion/106384/goldlawr-inc-v-heiman/,"Goldlawr, Inc. v. Heiman"
mad,federal,iac,Circuit,ca1,Co. v. U.S. Env’t Prot. Agency,2005,407 F.3d 1,noting that “a court can sua sponte order a transfer even absent a motion from either party”,10850751,Parikshit Gaikwad v. Amber Hanson,2026-04-06,mad,VERIFIED,https://www.courtlistener.com/opinion/201566/narragansett-electric-co-v-united-states-environmental-protection-agency/,Narragansett Electric Co. v. United States Environmental Protection Agency
mad,federal,iac,Circuit,ca1,"Baskin-Robbins Franchising LLC v. Alpenrose Dairy, Inc.",2016,825 F.3d 28,"first citing Sawtelle v. Farrell, 70 F.3d 1381, 1385 (1st Cir. 1995); and then citing C.W. Downer & Co. v. Bioriginal Food & Sci. Corp., 771 F.3d 59, 65 (1st Cir. 2014)",10850740,"CRA International, Inc. v. duPont Registry Group",2026-04-06,mad,VERIFIED,https://www.courtlistener.com/opinion/3209888/baskin-robbins-franchising-llc-v-alpenrose-dairy-inc/,"Baskin-Robbins Franchising LLC v. Alpenrose Dairy, Inc."
mad,federal,iac,Circuit,ca1,"Huffington v. T.C. Grp., LLC",2011,637 F.3d 18,"referring to the “unreasonable and unjust” condition as “more demanding” than a mere inquiry into “contacts” or “convenience” (citing Carnival Cruise Lines, Inc. v. Shute, 499 U.S. 585, 595 (1991))",10850740,"CRA International, Inc. v. duPont Registry Group",2026-04-06,mad,VERIFIED,https://www.courtlistener.com/opinion/205564/huffington-v-tc-group-llc/,"Huffington v. T.C. Group, LLC"
mad,federal,iac,Circuit,ca1,"Trans-Spec Truck Serv., Inc. v. Caterpillar Inc.",2008,524 F.3d 315,"“Under Rule 12(b)(6), the district court may properly consider only facts and documents that are part of or incorporated into the complaint.”",10850740,"CRA International, Inc. v. duPont Registry Group",2026-04-06,mad,VERIFIED,https://www.courtlistener.com/opinion/203275/trans-spec-truck-service-inc-v-caterpillar-inc/,"Trans-Spec Truck Service, Inc. v. Caterpillar Inc."
mad,federal,iac,Circuit,ca1,Schatz v. Republican State Leadership Comm.,2012,669 F.3d 50,"noting that in evaluating a Rule 12(b)(6) motion, courts “can consider (a) ‘implications from documents’ attached to or fairly ‘incorporated into the complaint,’ (b) ‘facts’ susceptible to ‘judicial notice,’ and (c",10850740,"CRA International, Inc. v. duPont Registry Group",2026-04-06,mad,VERIFIED,https://www.courtlistener.com/opinion/622598/schatz-v-republican-state-leadership-committee/,Schatz v. Republican State Leadership Committee
mad,federal,iac,Circuit,ca1,"Singh v. Blue Cross/Blue Shield of Massachusetts, Inc.",2002,308 F.3d 25,noting that a plaintiff “may not speculate about future business relationships when alleging this tort”,10850708,"William R. Thompson v. Navient Solutions, LLC, and Nelnet Servicing, LLC",2026-04-06,mad,VERIFIED,https://www.courtlistener.com/opinion/200100/singh-v-blue-crossblue-shield-of-massachusetts-inc/,"Singh v. Blue Cross/Blue Shield of Massachusetts, Inc."
mad,federal,iac,Circuit,ca1,Doidge v. Cunard S.S. Co.,1927,19 F.2d 500,“[O]ne [non-citizen] cannot sue another in a federal court unless a federal question is raised.”,10850700,"Apostle Dr. Ositadinma Israel Eagle Ekenedili Chukwu, Ph.D. v. Mr. John’s Food Company, Ltd. and Joseph Stephen",2026-04-06,mad,VERIFIED,https://www.courtlistener.com/opinion/1502288/doidge-v-cunard-s-s-co/,Doidge v. Cunard S. S. Co.
mad,federal,iac,Circuit,ca1,Cepero-Rivera v. Fagundo,2005,414 F.3d 124,“Only those individua[l] [state actors] who participated in the conduct that deprived the plaintiff of his rights can be held liable.”,10848034,Michael Jablonski v. Commonwealth of Massachusetts and Department of Correction,2026-04-03,mad,VERIFIED,https://www.courtlistener.com/opinion/201670/cepero-rivera-v-fagundo/,Cepero-Rivera v. Fagundo
mad,federal,iac,Circuit,ca1,In Bank of New England Corp.),2004,364 F.3d 355,"interpreting debt subordination agreement and explaining that “property interests should not be analyzed differently as a result of a party’s involvement in a bankruptcy case” (citing Butner v. United States, 440 U.S. 48, 55 (1979))",10848009,In re SCOTT D. ANDREWS v. EQUITY HOLDING CORP.,2026-04-03,mad,VERIFIED,https://www.courtlistener.com/opinion/200966/hsbc-bank-usa-v-bank-of-new-england/,HSBC Bank USA v. Bank of New England
mad,federal,iac,Circuit,ca1,"Tomasella v. Nestlé USA, Inc.",2020,962 F.3d 60,affirming dismissal of unjust enrichment claim where unambiguous terms of operative contract provided plaintiff adequate remedy at law,10848009,In re SCOTT D. ANDREWS v. EQUITY HOLDING CORP.,2026-04-03,mad,VERIFIED,https://www.courtlistener.com/opinion/4761442/tomasella-v-the-hershey-co/,Tomasella v. The Hershey Co.
mad,federal,iac,Circuit,ca1,"Latson v. Plaza Home Mortg., Inc.",2013,708 F.3d 324,rejecting tolling argument where challenged “terms” and “implications of [contractual] burdens were apparent” at signing,10848009,In re SCOTT D. ANDREWS v. EQUITY HOLDING CORP.,2026-04-03,mad,VERIFIED,https://www.courtlistener.com/opinion/821481/latson-v-plaza-home-mortgage-inc/,"Latson v. Plaza Home Mortgage, Inc."
mad,federal,iac,Circuit,ca1,"Wiener v. MIB Grp., Inc.",2023,86 F.4th 76,"“It is well-accepted that federal courts may take judicial notice of proceedings in other courts if those proceedings have relevance to the matters at hand.” (quoting Law Offices of David Efron v. Matthews & Fullmer Law Firm, 782 F.3d 46, 56 n.7 (1st Cir. 2015))",10847545,"DYLAN SCOTT CORRAL v. WARDEN, FMC DEVENS",2026-04-03,mad,VERIFIED,https://www.courtlistener.com/opinion/9438433/wiener-v-mib-group-inc/,"Wiener v. MIB Group, Inc."
mad,federal,iac,Circuit,ca1,"Wiener v. MIB Grp., Inc.",2023,86 F.4th 76,"“It is well-accepted that federal courts may take judicial notice of proceedings in other courts if those proceedings have relevance to the matters at hand.” (quoting Law Offs. of David Efron v. Matthews & Fullmer L. Firm, 782 F.3d 46, 56 n.7 (1st Cir. 2015))",10846565,"NJUH VALENTINE FOMBE v. WARDEN, FMC DEVENS",2026-04-02,mad,VERIFIED,https://www.courtlistener.com/opinion/9438433/wiener-v-mib-group-inc/,"Wiener v. MIB Group, Inc."
mad,federal,iac,Circuit,ca10,Benefield v. McDowall,2001,241 F.3d 1267,“[L]abeling an inmate a snitch has the potential for great harm and may violate constitutional guarantees.”,10845261,"Lance Hullum v. Stephen D. Adams, Taylor J. Landry, Steven C. Clark, and Brendon P. Metcalf",2026-04-01,mad,VERIFIED,https://www.courtlistener.com/opinion/160821/benefield-v-co-mcdowall/,Benefield v. C.O. McDowall
mad,federal,iac,Circuit,ca9,Neal v. Shimoda,1997,131 F.3d 818,“We can hardly conceive of a state’s action bearing more ‘stigmatizing consequences’ than the labeling of a prison inmate as a sex offender.”,10845261,"Lance Hullum v. Stephen D. Adams, Taylor J. Landry, Steven C. Clark, and Brendon P. Metcalf",2026-04-01,mad,VERIFIED,https://www.courtlistener.com/opinion/7056623/neal-v-shimoda/,Neal v. Shimoda
mad,federal,iac,Circuit,ca1,P.R. Tel. Co. v. San Juan Cable LLC,2017,874 F.3d 767,"“[A]rguments raised only in a footnote or in a perfunctory manner are waived.” (quoting Nat’l Foreign Trade Council v. Natsios, 181 F.3d 38, 60 n.17 (1st Cir. 1999))",10845261,"Lance Hullum v. Stephen D. Adams, Taylor J. Landry, Steven C. Clark, and Brendon P. Metcalf",2026-04-01,mad,VERIFIED,https://www.courtlistener.com/opinion/4439269/puerto-rico-tele-co-inc-v-san-juan-cable-llc/,"Puerto Rico Tele. Co., Inc. v. San Juan Cable LLC"
mad,federal,iac,Circuit,ca1,Acción v. Hernandez,2004,367 F.3d 61,"a “complaint should at least set forth minimal facts as to who did what to whom, when, where, and why—although why, when why means the actor’s state of mind, can be averred generally”",10848200,"Elaine Ivanowski v. Viv Auto Pilot, CleanSky Energy a/k/a Titan Gas LLC, Viviana Energy, Gloria Glaudin, and Titan Energy – New England Inc.",2026-03-31,mad,VERIFIED,https://www.courtlistener.com/opinion/8438243/educadores-puertorriquenos-en-accion-v-hernandez/,Educadores Puertorriqueños en Acción v. Hernández
mad,federal,iac,Circuit,ca1,"Grant v. News Grp. Bos., Inc.",1995,55 F.3d 1,"leave to amend may be denied “as a matter of law, where a proposed amendment would not cure the deficiencies in the original complaint”",10848200,"Elaine Ivanowski v. Viv Auto Pilot, CleanSky Energy a/k/a Titan Gas LLC, Viviana Energy, Gloria Glaudin, and Titan Energy – New England Inc.",2026-03-31,mad,VERIFIED,https://www.courtlistener.com/opinion/196043/grant-v-news-group-boston-inc/,"Grant v. News Group Boston, Inc."
mad,federal,iac,Circuit,ca9,"Gorman v. Wolpoff & Abramson, LLP",2009,584 F.3d 1147,“[a] notice of disputed information provided directly by the consumer to a furnisher does not trigger a furnisher’s duties under 15 U.S.C. § 1681s-2(b)”,10848188,Brunell St. Pierre v. Aidvantage Office Customer Advocate,2026-03-31,mad,VERIFIED,https://www.courtlistener.com/opinion/1436502/gorman-v-wolpoff-abramson-llp/,"Gorman v. Wolpoff & Abramson, LLP"
mad,federal,iac,Circuit,ca1,No. 05-1057,2005,2005 WL 5493113,"the FCRA “provides a private cause of action only if the furnisher received notice from a consumer reporting agency, as opposed to the plaintiff alone, that the credit information was disputed”",10848188,Brunell St. Pierre v. Aidvantage Office Customer Advocate,2026-03-31,mad,NOT_FOUND,,
mad,federal,colr,SCOTUS,scotus,Zenith Radio Corp. v. Hazeltine Rsch.,1971,401 U.S. 321,“It is settled that the grant of leave to amend the pleadings pursuant to Rule 15(a) is within the discretion of the trial court.”,10848188,Brunell St. Pierre v. Aidvantage Office Customer Advocate,2026-03-31,mad,VERIFIED,https://www.courtlistener.com/opinion/108279/zenith-radio-corp-v-hazeltine-research-inc/,"Zenith Radio Corp. v. Hazeltine Research, Inc."
mad,federal,iac,Circuit,ca1,Fuller,2011,642 F.3d 240,“[Plaintiffs] waited until they lost before asking for certification. This is almost always fatal unless the court sees strong policy reasons to insist on certification itself.”,10846960,"Lois Lama-Wolobah, as Personal Representative of the Estate of H.W. v. Paqui, LLC, Amplify Snack Brands, Inc., The Hershey Company, Walgreen Eastern Co., Inc. d/b/a Walgreen #03151, Walgreens of Massachusetts, LLC, James Connolly, and Jane Doe",2026-03-31,mad,VERIFIED,https://www.courtlistener.com/opinion/8440951/fuller-v-deutsche-bank-national-trust-co/,Fuller v. Deutsche Bank National Trust Co.
mad,federal,iac,Circuit,ca1,"Bos. Car Co. v. Acura Auto. Div., Am. Honda Motor Co.",1992,971 F.2d 811,"“[T]he practice of requesting certification after an adverse judgment has been entered should be discouraged.” (quoting Perkins v. Clarl Equip., 823 F.2d 207, 210 (8th Cir. 1987))",10846960,"Lois Lama-Wolobah, as Personal Representative of the Estate of H.W. v. Paqui, LLC, Amplify Snack Brands, Inc., The Hershey Company, Walgreen Eastern Co., Inc. d/b/a Walgreen #03151, Walgreens of Massachusetts, LLC, James Connolly, and Jane Doe",2026-03-31,mad,VERIFIED,https://www.courtlistener.com/opinion/588108/boston-car-company-inc-dba-acura-of-boston-v-acura-automobile/,"Boston Car Company, Inc., D/B/A Acura of Boston v. Acura Automobile Division, American Honda Motor Co., Inc."
mad,federal,iac,Circuit,ca4,Young v. City of Mount Ranier,2001,238 F.3d 567,“[A] plaintiff does not forfeit the right to challenge the dismissal on appeal simply by filing an amended complaint that does not re- allege the dismissed claim.”,10846960,"Lois Lama-Wolobah, as Personal Representative of the Estate of H.W. v. Paqui, LLC, Amplify Snack Brands, Inc., The Hershey Company, Walgreen Eastern Co., Inc. d/b/a Walgreen #03151, Walgreens of Massachusetts, LLC, James Connolly, and Jane Doe",2026-03-31,mad,VERIFIED,https://www.courtlistener.com/opinion/7086687/young-v-city-of-mount-ranier/,Young v. City of Mount Ranier
mad,federal,iac,Circuit,ca1,Cicchetti v. Lucy,1975,514 F.2d 362,"“[A]n amended complaint normally is treated as completely replacing the former pleading, even the residual claim for damages disappeared . . . when the district court granted the motion to amend.”",10846960,"Lois Lama-Wolobah, as Personal Representative of the Estate of H.W. v. Paqui, LLC, Amplify Snack Brands, Inc., The Hershey Company, Walgreen Eastern Co., Inc. d/b/a Walgreen #03151, Walgreens of Massachusetts, LLC, James Connolly, and Jane Doe",2026-03-31,mad,VERIFIED,https://www.courtlistener.com/opinion/326902/john-b-cicchetti-v-david-j-lucey-registrar-of-motor-vehicles/,"John B. Cicchetti v. David J. Lucey, Registrar of Motor Vehicles"
mad,federal,iac,Circuit,cadc,Certified Pub. Accts. v. I.R.S.,2015,804 F.3d 1193,explaining that the zone of interests test must be treated procedurally like any other “non- jurisdictional issue”,10846939,"Atif Tasneem v. Stufft, et al.",2026-03-31,mad,VERIFIED,https://www.courtlistener.com/opinion/3150930/american-institute-of-certified-public-accountants-v-internal-revenue/,American Institute of Certified Public Accountants v. Internal Revenue Service
mad,federal,iac,Circuit,ca9,"Li Hing  Hong Kong, Inc. v. Levin",1986,800 F.2d 970,“The [INA] thereby conferred upon consular officials the authority to issue or withhold visas . . . Congress specifically exempted the exercise of this power from review by the Secretary of State.”,10846939,"Atif Tasneem v. Stufft, et al.",2026-03-31,mad,VERIFIED,https://www.courtlistener.com/opinion/475841/li-hing-of-hong-kong-inc-and-yee-lee-soon-v-burton-levin-counsel/,"Li Hing of Hong Kong, Inc., and Yee Lee Soon v. Burton Levin, Counsel General of the United States of America for Hong Kong"
mad,federal,iac,Circuit,ca9,Patel v. Reno,1997,134 F.3d 929,"“[W]hen [a] suit challenges the authority of the consul to take or fail to take an action as opposed to a decision taken within the consul’s discretion, jurisdiction exists.”",10846939,"Atif Tasneem v. Stufft, et al.",2026-03-31,mad,VERIFIED,https://www.courtlistener.com/opinion/7058772/patel-v-reno/,Patel v. Reno
mad,federal,iac,Circuit,ca4,Gonzalez v. Cuccinelli,2021,985 F.3d 357,finding “[in]sufficient information to resolve this issue on a motion to dismiss” because “[a] claim of unreasonable delay is necessarily fact dependent and thus sits uncomfortably at the motion to dismiss stage and should not typically be resolved at that stage”,10846939,"Atif Tasneem v. Stufft, et al.",2026-03-31,mad,VERIFIED,https://www.courtlistener.com/opinion/4847861/ansberto-gonzalez-v-kenneth-cuccinelli-ii/,"Ansberto Gonzalez v. Kenneth Cuccinelli, II"
mad,federal,iac,Circuit,cadc,"Mashpee Wampanoag Tribal Council, Inc. v. Norton",2003,336 F.3d 1094,"“[The rule of reason] cannot be decided in the abstract, by reference to some number of months or years beyond which agency inaction is presumed to be unlawful but will depend in large part . . . upon the complexity of the task at hand, the significance (and permanence",10846939,"Atif Tasneem v. Stufft, et al.",2026-03-31,mad,VERIFIED,https://www.courtlistener.com/opinion/186035/mashpee-tribal-cncl-v-norton-gale-a/,"Mashpee Tribal Cncl v. Norton, Gale A."
mad,federal,iac,Circuit,ca2,Chen v. Rubio,2025,158 F.4th 393,“Plaintiffs point us to no reason – and we find none – to treat a citizen sponsoring a . . . sibling differently from one sponsoring a spouse.”,10846939,"Atif Tasneem v. Stufft, et al.",2026-03-31,mad,NOT_FOUND,,
mad,federal,iac,Circuit,ca1,"United States v. Swiss Am. Bank, Ltd.",2001,274 F.3d 610,“When a district court rules on a motion to dismiss for lack of personal jurisdiction without holding an evidentiary hearing . . . the ‘prima facie’ standard governs its determination.” (first citing United Electrical Radio & Machine Workers of America (UE,10845305,"Joel Fuller v. Carrera & Partners, Inc. and Nick Carrera",2026-03-31,mad,VERIFIED,https://www.courtlistener.com/opinion/199746/united-states-v-swiss-american-bank-ltd/,"United States v. Swiss American Bank, Ltd."
mad,federal,iac,Circuit,ca1,Cossart v. United Excel Corp.,2015,804 F.3d 13,“The requirements of the Massachusetts long-arm statute are similar to— although not necessarily the same as—those imposed by the Due Process Clause.”,10845305,"Joel Fuller v. Carrera & Partners, Inc. and Nick Carrera",2026-03-31,mad,VERIFIED,https://www.courtlistener.com/opinion/3006256/cossart-v-united-excel-corporation/,Cossart v. United Excel Corporation
mad,federal,iac,Circuit,ca1,Hahn v. Vt. L. Sch.,1983,698 F.2d 48,referring to “several indications in the Massachusetts case law that the language ‘transacting any business’ should be construed broadly”,10845305,"Joel Fuller v. Carrera & Partners, Inc. and Nick Carrera",2026-03-31,mad,VERIFIED,https://www.courtlistener.com/opinion/413304/william-a-hahn-v-vermont-law-school/,William A. Hahn v. Vermont Law School
