source_court,system,level,tier_label,cited_court_id,cited_case_name,cited_year,citation_text,parenthetical,citing_cluster_id,citing_case,citing_date,citing_court,v1_v_status,v1_v_url,v1_v_matched_name
dcd,federal,colr,SCOTUS,scotus,Mathews v. Diaz,1976,426 U.S. 67,"“In the exercise of its broad power over naturalization and immigration, Congress regularly makes rules that would be unacceptable if applied to citizens.”",10851374,N. v. U.S. Department of Health and Human Services,2026-04-30,dcd,VERIFIED,https://www.courtlistener.com/opinion/109463/mathews-v-diaz/,Mathews v. Diaz
dcd,federal,iac,Circuit,cadc,Bennett v. Donovan,2013,703 F.3d 582,“[I]t is the prerogative of the agency to decide in the first instance how best to provide relief.”,10851374,N. v. U.S. Department of Health and Human Services,2026-04-30,dcd,VERIFIED,https://www.courtlistener.com/opinion/814770/robert-bennett-v-shaun-donovan/,Robert Bennett v. Shaun Donovan
dcd,federal,iac,Circuit,ca4,Wojcicki v. SCANA/SCE&G,2020,947 F.3d 240,"affirming the district court’s dismissal of an FCA suit for failure to prosecute, where the relator did not comply with the court’s order to hire counsel",10851364,"Dow v. Hc2, Inc.",2026-04-30,dcd,VERIFIED,https://www.courtlistener.com/opinion/4695642/joseph-wojcicki-v-scana-corporation/,Joseph Wojcicki v. SCANA Corporation
dcd,federal,iac,Circuit,ca2,Chailla v. Navient Dep’t of Educ.,2019,791 F. App’x 226,"affirming the district court’s dismissal of a relator’s claims after the relator “failed to retain counsel, despite being granted ample opportunity to do so”",10851364,"Dow v. Hc2, Inc.",2026-04-30,dcd,NOT_FOUND,,
dcd,federal,iac,Circuit,cadc,SEC v. Am. Int’l Grp.,2013,712 F.3d 1,defining judicial records to include only records the court relied on or made decisions about,10851364,"Dow v. Hc2, Inc.",2026-04-30,dcd,VERIFIED,https://www.courtlistener.com/opinion/818009/securities-exchange-commission-v-american-international-group/,Securities & Exchange Commission v. American International Group
dcd,federal,colr,SCOTUS,scotus,Wachovia Bank v. Schmidt,2006,546 U.S. 303,"holding that for purposes of establishing diversity jurisdiction, a national bank is located “in the State designated in its articles of association as its main office”",10851325,Campbell v. Citigroup,2026-04-30,dcd,VERIFIED,https://www.courtlistener.com/opinion/145692/wachovia-bank-national-assn-v-schmidt/,"Wachovia Bank, National Ass'n v. Schmidt"
dcd,federal,colr,SCOTUS,scotus,Smith v. Spizzirri,2024,601 U.S. 472,"“When a district court finds that a lawsuit involves an arbitrable dispute, and a party requests a stay pending arbitration, § 3 of the FAA compels the court to stay the proceeding.”",10851325,Campbell v. Citigroup,2026-04-30,dcd,VERIFIED,https://www.courtlistener.com/opinion/10600092/smith-v-spizzirri/,Smith v. Spizzirri
dcd,federal,iac,Circuit,ca5,"D’Onofrio v. Vacation Publ’ns, Inc.",2018,888 F.3d 197,"approving supplemental jurisdiction over an employer’s counterclaims, including breach of fiduciary duty, against an employee’s husband because those counterclaims operated as a defense to the employee’s claim",10851118,Adams v. Fort Myer Construction Corporation,2026-04-30,dcd,VERIFIED,https://www.courtlistener.com/opinion/4492357/karen-donofrio-v-vacation-publications-i/,"Karen D'Onofrio v. Vacation Publications, I"
dcd,federal,iac,Circuit,cadc,S. Cal. v. Barr,1991,952 F.2d 457,“Rule 12(b)(6) is not a device for testing the truth of what is asserted or for determining whether a plaintiff has any evidence to back up what is in the complaint.”,10851118,Adams v. Fort Myer Construction Corporation,2026-04-30,dcd,VERIFIED,https://www.courtlistener.com/opinion/574869/aclu-foundation-of-southern-california-v-william-p-barr/,Aclu Foundation of Southern California v. William P. Barr
dcd,federal,iac,Circuit,cadc,"Brown v. Whole Foods Mkt. Grp., Inc.",2015,789 F.3d 146,concluding the same in the context of a motion to dismiss pursuant to Rule 12(b)(6),10851116,"Rubio v. Credence Management Solutions, LLC",2026-04-30,dcd,VERIFIED,https://www.courtlistener.com/opinion/2807857/randy-brown-v-whole-foods-market-group-inc/,"Randy Brown v. Whole Foods Market Group, Inc"
dcd,federal,colr,SCOTUS,scotus,McNeil v. United States,1993,508 U.S. 106,“[W]e have never suggested that procedural rules in ordinary civil litigation should be interpreted so as to excuse mistakes by those who proceed without counsel.”,10851116,"Rubio v. Credence Management Solutions, LLC",2026-04-30,dcd,VERIFIED,https://www.courtlistener.com/opinion/112858/mcneil-v-united-states/,McNeil v. United States
dcd,federal,colr,SCOTUS,scotus,Irwin v. Dep’t of Veterans Affs.,2010,498 U.S. 89,finding that equitable The DCHRA was recently amended to enlarge the statute of limitations to a two-year period. See § 2–1403.16(a,10851116,"Rubio v. Credence Management Solutions, LLC",2026-04-30,dcd,VERIFIED,https://www.courtlistener.com/opinion/112510/irwin-v-department-of-veterans-affairs/,Irwin v. Department of Veterans Affairs
dcd,federal,iac,Circuit,cadc,Payne v. D.C. Gov’t,2013,722 F.3d 345,noting that statutes are construed as having only prospective operation absent clear legislative intent that the statute should be applied retroactively,10851116,"Rubio v. Credence Management Solutions, LLC",2026-04-30,dcd,VERIFIED,https://www.courtlistener.com/opinion/895554/payne-v-district-of-columbia-government/,Payne v. District of Columbia Government
dcd,federal,iac,Circuit,cadc,Comm. v. Webster,1983,720 F.2d 29,"explaining that the FRA ""establish[es] a unified system for handling the 'life cycle' of federal records-covering their creation, maintenance and use, and eventually their disposal by either destruction or deposit for preservation""",10850557,Williams v. National Aeronautics and Space Administration,2026-04-29,dcd,VERIFIED,https://www.courtlistener.com/opinion/426340/american-friends-service-committee-v-william-h-webster-director-federal/,"American Friends Service Committee v. William H. Webster, Director, Federal Bureau of Investigation, (Three Cases)"
dcd,federal,iac,Circuit,cadc,Chaplaincy  Full Gospel Churches v. England,2006,454 F.3d 290,"""A movant's failure to show any irreparable harm is .. . grounds for refusing to issue a preliminary injunction, even if the other three factors entering the calculus merit such relief.""",10850557,Williams v. National Aeronautics and Space Administration,2026-04-29,dcd,VERIFIED,https://www.courtlistener.com/opinion/186744/chaplaincy-of-full-gospel-churches-v-england/,Chaplaincy of Full Gospel Churches v. England
dcd,federal,iac,Circuit,cadc,"Int’l Mar. Org. No. 9189952, No. 24- 5218",2026,2026 WL 1073317,"affirming denial of private company’s motion to dismiss government’s civil forfeiture action, finding that the offense conduct of the National Iranian Oil Company (“NIOC”",10850406,United States v. Gutierrez-Ochoa,2026-04-29,dcd,NOT_FOUND,,
dcd,federal,iac,Circuit,ca11,“Stansell I”),2014,771 F.3d 713,"approving definition of “agency or instrumentality” set out by district court, in Stansell v. Revolutionary Armed Forces of Colom., No. 09-cv-2308, 2013 WL 12133661, at *2 (M.D. Fla. May 2, 2013",10850406,United States v. Gutierrez-Ochoa,2026-04-29,dcd,VERIFIED,https://www.courtlistener.com/opinion/2742884/keith-stansell-v-revolutionary-armed-forces-of-columbia-farc/,"Keith Stansell v. Revolutionary Armed Forces of Columbia, (FARC)"
dcd,federal,colr,SCOTUS,scotus,Libretti v. United States,1995,516 U.S. 29,"“Once the Government has secured a stipulation as to forfeitability, third-party claimants can establish their entitlement to return of the assets only by means of the hearing afforded under 21 U.S.C. § 853(n).”",10850406,United States v. Gutierrez-Ochoa,2026-04-29,dcd,VERIFIED,https://www.courtlistener.com/opinion/117979/libretti-v-united-states/,Libretti v. United States
dcd,federal,iac,Circuit,ca5,Relief & Dev.,2013,722 F.3d 677,"holding that “[b]y its terms, [TRIA] § 201 does not provide for execution against assets that are not blocked”",10850406,United States v. Gutierrez-Ochoa,2026-04-29,dcd,VERIFIED,https://www.courtlistener.com/opinion/938974/united-states-v-holy-land-foundation-for-relief-development/,United States v. Holy Land Foundation for Relief & Development
dcd,federal,iac,Circuit,ca1,Rubin v. Islamic Republic of Iran,2013,709 F.3d 49,"“Nonetheless, under certain circumstances, TRIA permits the attachment of property that might otherwise be immune under the FSIA.”",10850406,United States v. Gutierrez-Ochoa,2026-04-29,dcd,VERIFIED,https://www.courtlistener.com/opinion/821480/rubin-v-islamic-republic-of-iran/,Rubin v. Islamic Republic of Iran
dcd,federal,iac,Circuit,ca2,Havlish v. Taliban,2025,152 F.4th 339,stating that the “notwithstanding” clause “carries great weight in our analysis of how the TRIA interacts with the FSIA” and that “there can be no doubt that the FSIA’s execution immunity provisions are superseded by the TRIA”,10850406,United States v. Gutierrez-Ochoa,2026-04-29,dcd,NOT_FOUND,,
dcd,federal,iac,Circuit,cadc,Int’l Dev.,1993,994 F.2d 874,“Pro se litigants are allowed more latitude than litigants represented by counsel to correct defects in service of process and pleadings.”,10849253,"Hiligh v. Duncan & Hopkins, P.C.",2026-04-28,dcd,VERIFIED,https://www.courtlistener.com/opinion/608074/brian-p-moore-v-agency-for-international-development/,Brian P. Moore v. Agency for International Development
dcd,federal,iac,Circuit,ca2,United States v. Libous,2017,858 F.3d 64,reasoning that “[t]here is no legal basis on which the state can retain a fine exacted from Libous as punishment for an offense he is now presumed not to have committed” but not discussing restitution as no restitution had not been ordered,10849233,United States v. Ochs,2026-04-28,dcd,VERIFIED,https://www.courtlistener.com/opinion/8443303/united-states-v-libous/,United States v. Libous
dcd,federal,iac,Circuit,ca7,United States v. Volpendesto,2014,755 F.3d 448,"finding that “[w]ithout a final criminal conviction, there can be no order of restitution,” but never considering whether paid funds must be returned",10849233,United States v. Ochs,2026-04-28,dcd,VERIFIED,https://www.courtlistener.com/opinion/2708586/united-states-v-samuel-volpendesto/,United States v. Samuel Volpendesto
dcd,federal,iac,Circuit,cadc,United States v. Pogue,1994,19 F.3d 663,“The abatement rule applies when a direct appeal is pending at the time of appellant’s death.” (emphasis in original),10849233,United States v. Ochs,2026-04-28,dcd,VERIFIED,https://www.courtlistener.com/opinion/665974/united-states-v-edward-c-pogue-iii/,"United States v. Edward C. Pogue, III"
dcd,federal,iac,Circuit,ca10,United States v. Coddington,2020,802 F. App’x 373,"“remand[ing] to the district court with instructions to vacate the judgment, including the convictions and restitution order,” but not expressly contemplating ordering return of restitution funds",10849233,United States v. Ochs,2026-04-28,dcd,NOT_FOUND,,
dcd,federal,iac,Circuit,ca7,Bogie v. Rosenberg,2013,705 F.3d 603,finding video footage incorporated in the complaint and suitable to consideration of a motion to dismiss,10849132,Wiggins v. District of Columbia,2026-04-28,dcd,VERIFIED,https://www.courtlistener.com/opinion/815531/ann-bogie-v-joan-alexandrasanger/,Ann Bogie v. Joan AlexandraSanger
dcd,federal,iac,Circuit,ca4,United States v. Armel,2009,585 F.3d 182,"rejecting argument that the First Amendment prohibited prosecution for the statement, “You come and try to pull on me . . . [y]ou will die. Not by my hand, by the hand of God. Or maybe by my hand, but it will be self- defense”",10849132,Wiggins v. District of Columbia,2026-04-28,dcd,VERIFIED,https://www.courtlistener.com/opinion/1030505/united-states-v-armel/,United States v. Armel
dcd,federal,iac,Circuit,cadc,Kaempe v. Myers,2004,367 F.3d 958,explaining that a court need not “accept as true the complaint’s factual allegations insofar as they contradict exhibits to the complaint”,10849132,Wiggins v. District of Columbia,2026-04-28,dcd,VERIFIED,https://www.courtlistener.com/opinion/186196/kaempe-staffan-v-myers-george/,"Kaempe, Staffan v. Myers, George"
dcd,federal,iac,Circuit,cadc,United States v. Mills,1991,925 F.2d 455,"The “Sixth Amendment analysis would comprehend the entire time span from the appellees’ indictment in Superior Court to the dismissal of the federal charges against them, given that the same federal prosecutors controlled both prosecutions.”",10848714,United States v. White,2026-04-27,dcd,VERIFIED,https://www.courtlistener.com/opinion/555697/united-states-v-albert-e-mills-united-states-of-america-v-kenneth-b/,United States v. Albert E. Mills. United States of America v. Kenneth B. Wonson. United States of America v. Vernon L. Holland
dcd,federal,iac,Circuit,cadc,United States v. Jones,1970,433 F.2d 1176,“The supervisory power doctrine is an extraordinary one which should be sparingly exercised.” (cleaned up),10848714,United States v. White,2026-04-27,dcd,VERIFIED,https://www.courtlistener.com/opinion/293063/united-states-v-clifford-a-jones/,United States v. Clifford A. Jones
dcd,federal,iac,Circuit,cadc,United States v. Safavian,2011,649 F.3d 688,“The doctrine of prosecutorial vindictiveness . . . precludes action by a prosecutor that is designed to penalize a defendant for invoking any legally protected right[.]” (cleaned up),10848714,United States v. White,2026-04-27,dcd,VERIFIED,https://www.courtlistener.com/opinion/216669/united-states-v-david-safavian/,United States v. David Safavian
dcd,federal,iac,Circuit,cadc,Kincaid v. District of Columbia,2017,854 F.3d 721,"clarifying that the District of Columbia is subject to the Due Process Clause of the Fifth Amendment, not the Fourteenth, but the same due process analysis applies",10848714,United States v. White,2026-04-27,dcd,VERIFIED,https://www.courtlistener.com/opinion/4385702/patrick-kincaid-v-government-of-the-district-of-columbia/,Patrick Kincaid v. Government of the District of Columbia
dcd,federal,iac,Circuit,ca9,McMillan v. Gomez,1994,19 F.3d 465,“The felony murder rule is too deeply rooted in Anglo-American jurisprudence to be questioned now.”,10848714,United States v. White,2026-04-27,dcd,VERIFIED,https://www.courtlistener.com/opinion/665851/joe-henry-mcmillan-v-al-gomez-warden-of-deuel-vocational-institute/,"Joe Henry McMillan v. Al Gomez, Warden of Deuel Vocational Institute"
dcd,federal,iac,Circuit,cadc,Williams v. Johnson,2015,776 F.3d 865,“We defer to the District of Columbia Court of Appeals’ interpretation of the D.C. Code.”,10848714,United States v. White,2026-04-27,dcd,VERIFIED,https://www.courtlistener.com/opinion/2770505/christina-williams-v-robert-johnson/,Christina Williams v. Robert Johnson
dcd,federal,colr,SCOTUS,scotus,Herring v. United States,2009,555 U.S. 135,explaining that the exclusionary rule “applies only where it results in appreciable deterrence” (cleaned up),10848714,United States v. White,2026-04-27,dcd,VERIFIED,https://www.courtlistener.com/opinion/145922/herring-v-united-states/,Herring v. United States
dcd,federal,iac,Circuit,ca11,United States v. Gonzalez,2024,107 F.4th 1304,noting that every Circuit to face the issue has held that neither a felony nor a misdemeanor needs to have been committed in the officers’ presence to support a warrantless arrest,10848714,United States v. White,2026-04-27,dcd,VERIFIED,https://www.courtlistener.com/opinion/10007818/united-states-v-victor-javier-grandia-gonzalez/,United States v. Victor Javier Grandia Gonzalez
dcd,federal,colr,SCOTUS,scotus,Atwater v. City of Lago Vista,2001,532 U.S. 318,reserving the question of whether “the Fourth Amendment entails an ‘in the presence’ requirement for purposes of misdemeanor arrests”,10848714,United States v. White,2026-04-27,dcd,VERIFIED,https://www.courtlistener.com/opinion/2620702/atwater-v-city-of-lago-vista/,Atwater v. City of Lago Vista
dcd,federal,iac,Circuit,cadc,United States v. Moore,2011,651 F.3d 30,"“When evidence of such acts is intrinsic to the charged crime, it is not evidence of other acts and is thus wholly unregulated by Rule 404(b).” (cleaned up)",10848714,United States v. White,2026-04-27,dcd,VERIFIED,https://www.courtlistener.com/opinion/222130/united-states-v-moore/,United States v. Moore
dcd,federal,iac,Circuit,ca8,"United States v. Wilburn, --- F.4th ---",2026,2026 WL 913399,“There was little risk of unfair prejudice from testimony that Wilburn was on parole because the jury elsewhere received evidence that he was convicted of a felony in 2021.”,10848714,United States v. White,2026-04-27,dcd,NOT_FOUND,,
dcd,federal,iac,Circuit,ca5,United States v. Jones,2019,930 F.3d 366,“Jones’s judgment of conviction was admissible to prove an element of one of his charged offenses. The additional prejudicial effect of permitting the jury to consider Jones’s prior conviction to help determine his intent was therefore diminished.”,10848714,United States v. White,2026-04-27,dcd,VERIFIED,https://www.courtlistener.com/opinion/4636213/united-states-v-coy-jones/,United States v. Coy Jones
dcd,federal,iac,Circuit,ca2,United States v. Williams,2013,526 F. App’x 29,"“[B]ecause an element of the offense charged involved being a convicted felon, there was very little risk of Page 45 of 51 unfair prejudice to Williams in introducing evidence of his 1997 conviction because the jury already knew of his status as a felon.”",10848714,United States v. White,2026-04-27,dcd,VERIFIED,https://www.courtlistener.com/opinion/875337/united-states-v-williams/,United States v. Williams
dcd,federal,iac,Circuit,cadc,United States v. Han,2020,962 F.3d 568,appropriate safeguards to minimize the danger of unfair prejudice include a limit on what details the Government can elicit and a precautionary limiting instruction,10848714,United States v. White,2026-04-27,dcd,VERIFIED,https://www.courtlistener.com/opinion/4762431/united-states-v-michael-han/,United States v. Michael Han
dcd,federal,iac,Circuit,cadc,United States v. Straker,2015,800 F.3d 570,upholding admission of other crimes evidence where the district court “prevented the government from soliciting testimony about particularly prejudicial details”,10848714,United States v. White,2026-04-27,dcd,VERIFIED,https://www.courtlistener.com/opinion/2832658/united-states-v-straker/,United States v. Straker
dcd,federal,iac,Circuit,ca6,United States v. Fields,2014,763 F.3d 443,“The mere fact that each defendant ‘points the finger’ at his co-defendant is insufficient” to require severance.,10848714,United States v. White,2026-04-27,dcd,POSSIBLE_MATCH,https://www.courtlistener.com/opinion/2717735/united-states-v-martin-lewis/,United States v. Martin Lewis
dcd,federal,iac,Circuit,cafc,"Trebro Mfg., Inc. v. Firefly Equip., LLC",2013,748 F.3d 1159,"“The grant[ or] denial . . . of a preliminary injunction is not unique to patent law, so [district] court[s] appl[y] the law of the regional circuit when [deciding] such a decision.”",10848672,"9878866 Canada Inc. v. Intake Breathing Technology, LLC",2026-04-27,dcd,VERIFIED,https://www.courtlistener.com/opinion/2669287/trebro-manufacturing-inc-v-firefly-equipment-llc/,"Trebro Manufacturing, Inc. v. Firefly Equipment, LLC"
dcd,federal,colr,SCOTUS,scotus,Leman v. Krentler-Arnold Hinge Last Co.,1932,284 U.S. 448,"explaining that when a party brings a suit in federal district court, “it submit[s] itself to the jurisdiction of the [C]ourt with respect to all the issues embraced in the suit, including those pertaining to the counterclaim of the defendants”",10848672,"9878866 Canada Inc. v. Intake Breathing Technology, LLC",2026-04-27,dcd,VERIFIED,https://www.courtlistener.com/opinion/101838/leman-v-krentler-arnold-hinge-last-co/,Leman v. Krentler-Arnold Hinge Last Co.
dcd,federal,colr,SCOTUS,scotus,Guinee,1982,456 U.S. 694,"“Because the requirement of personal jurisdiction represents first of all an individual right, it can, like other such rights, be waived.”",10848672,"9878866 Canada Inc. v. Intake Breathing Technology, LLC",2026-04-27,dcd,VERIFIED,https://www.courtlistener.com/opinion/110715/insurance-corp-of-ireland-v-compagnie-des-bauxites-de-guinee/,Insurance Corp. of Ireland v. Compagnie Des Bauxites De Guinee
dcd,federal,iac,Circuit,cadc,Global Health Council v. Trump,2025,153 F.4th 1,referring to the factors courts weigh in deciding whether to issue a preliminary injunction as the “Winter factors”,10848672,"9878866 Canada Inc. v. Intake Breathing Technology, LLC",2026-04-27,dcd,NOT_FOUND,,
dcd,federal,iac,Circuit,cafc,"Entegris, Inc. v. Pall Corp.",2007,490 F.3d 1340,explaining that a “patent holder seeking a preliminary injunction bears the burden of establishing a likelihood of success on the merits with respect to the patent’s validity”,10848672,"9878866 Canada Inc. v. Intake Breathing Technology, LLC",2026-04-27,dcd,VERIFIED,https://www.courtlistener.com/opinion/210569/entegris-formerly-known-as-mykrolis-corporation-v-pall-corporation/,Entegris (Formerly Known as Mykrolis Corporation) v. Pall Corporation
dcd,federal,iac,Circuit,ca1,Castro,1988,843 F.2d 631,explaining that it is the party’s task to spell out its arguments squarely and distinctly,10848672,"9878866 Canada Inc. v. Intake Breathing Technology, LLC",2026-04-27,dcd,VERIFIED,https://www.courtlistener.com/opinion/504001/martin-rivera-gomez-v-rafael-adolfo-de-castro/,Martin Rivera-Gomez v. Rafael Adolfo De Castro
dcd,federal,iac,Circuit,cafc,"Vitronics Corp. v. Conceptronic, Inc.",1996,90 F.3d 1576,explaining that the specification “is the single best guide to the meaning of a disputed term”,10848672,"9878866 Canada Inc. v. Intake Breathing Technology, LLC",2026-04-27,dcd,VERIFIED,https://www.courtlistener.com/opinion/722611/vitronics-corporation-v-conceptronic-inc/,"Vitronics Corporation v. Conceptronic, Inc."
dcd,federal,colr,SCOTUS,scotus,Festo Corp. v. Shoketsu Kinzoku Kogyo Kabushiki Co.,2014,535 U.S. 722,"explaining that the definiteness “requirement is not a demand for unreasonable precision” and that “verbal precision” in every case is not possible “in a patent system that actually works, in practice”",10848672,"9878866 Canada Inc. v. Intake Breathing Technology, LLC",2026-04-27,dcd,VERIFIED,https://www.courtlistener.com/opinion/118510/festo-corp-v-shoketsu-kinzoku-kogyo-kabushiki-co/,Festo Corp. v. Shoketsu Kinzoku Kogyo Kabushiki Co.
dcd,federal,iac,Circuit,cafc,Packard,2014,751 F.3d 1307,"explaining that the definiteness “requirement is not a demand for unreasonable precision” and that “verbal precision” in every case is not possible “in a patent system that actually works, in practice”",10848672,"9878866 Canada Inc. v. Intake Breathing Technology, LLC",2026-04-27,dcd,VERIFIED,https://www.courtlistener.com/opinion/2672661/inre-packard/,Inre: Packard
dcd,federal,iac,Circuit,cafc,"Bose Corp. v. JBL, Inc.",2001,274 F.3d 1354,explaining that “the limitation the outer surface of said sphere would not require an antecedent recitation that the sphere have an outer surface”,10848672,"9878866 Canada Inc. v. Intake Breathing Technology, LLC",2026-04-27,dcd,VERIFIED,https://www.courtlistener.com/opinion/775951/bose-corporation-v-jbl-inc-and-infinity-systems-corporation/,"Bose Corporation v. Jbl, Inc. And Infinity Systems Corporation"
dcd,federal,iac,Circuit,cafc,Broadcom Corp. v. Int’l Trade Comm’n,2022,28 F. 4th 240,affirming the United States Patent and Trademark Office Patent Trial and Appeal Board’s finding of no invalidity for obviousness where cited prior art references did not teach one of the limitations of the patent-at-issue,10848672,"9878866 Canada Inc. v. Intake Breathing Technology, LLC",2026-04-27,dcd,VERIFIED,https://www.courtlistener.com/opinion/6449368/broadcom-corporation-v-itc/,Broadcom Corporation v. Itc
dcd,federal,iac,Circuit,cafc,Acumed LLC v. Stryker Corp.,2008,551 F.3d 1323,“The essential attribute of a patent grant is that it provides a right to exclude competitors from infringing the patent”,10848672,"9878866 Canada Inc. v. Intake Breathing Technology, LLC",2026-04-27,dcd,VERIFIED,https://www.courtlistener.com/opinion/209409/acumed-llc-v-stryker-corp/,ACUMED LLC v. Stryker Corp.
dcd,federal,iac,Circuit,cafc,"Celsis In Vitro, Inc. v. CellzDirect, Inc.",2012,664 F.3d 922,affirming a district court’s finding of irreparable harm when the testimony included evidence that a patentee was “precluded from marketing to potential and existing customers that it [was] the exclusive market leader”,10848672,"9878866 Canada Inc. v. Intake Breathing Technology, LLC",2026-04-27,dcd,VERIFIED,https://www.courtlistener.com/opinion/620487/celsis-in-vitro-inc-v-cellzdirect-inc/,"Celsis in Vitro, Inc. v. CellzDirect, Inc."
dcd,federal,colr,SCOTUS,scotus,Shaw v. Cooper,1833,32 U.S. 292,"“The policy of granting exclusive privileges in certain cases, was deemed of so much importance in a national point of view, that power was given to congress in the federal constitution.”",10848672,"9878866 Canada Inc. v. Intake Breathing Technology, LLC",2026-04-27,dcd,VERIFIED,https://www.courtlistener.com/opinion/85831/shaw-v-cooper/,Shaw v. Cooper
dcd,federal,iac,Circuit,cafc,"Sanofi–Synthelabo v. Apotex, Inc.",2006,470 F.3d 1368,“The amount of a bond is a determination that rests within the sound discretion of a trial court.”,10848672,"9878866 Canada Inc. v. Intake Breathing Technology, LLC",2026-04-27,dcd,VERIFIED,https://www.courtlistener.com/opinion/210926/sanofi-synthelabo-v-apotex-inc/,"Sanofi-Synthelabo v. Apotex, Inc."
