pdf,citation_text,context,classification,case_name,plaintiff,defendant,volume,reporter,page,court,year,month,day,docket_number,is_westlaw,wl_number,review_reason,v_status,v_confidence,v_url,v_matched_name,v_git_hash,qc_status,qc_notes,
flowz_digital_llc_v_flowz_staffing_llc_5-30-2025_order.pdf,"In re Daou Systems, Inc., 411 F.3d 1006 (9th Cir. 2005)","...rder. Nor does Plaintiff's response assuage the Court's concerns about the errors in its opposition to the motion to dismiss. The relevance of two of Plaintiff's cited cases—In re Daou Systems, Inc., 411 F.3d 1006 (9th Cir. 2005) and S.E.C. v. Cross Financial Services, Inc., 908 F. Supp. 718 (C.D",uncertain,"In re Daou Systems, Inc.",,,411,F.3d,1006,ca9,2005,,,,FALSE,,,VERIFIED,1,https://www.courtlistener.com/opinion/8438896/sparling-v-daou/,Sparling v. Daou,fbdbb4a,approved,,
flowz_digital_llc_v_flowz_staffing_llc_5-30-2025_order.pdf,"S.E.C. v. Cross Financial Services, Inc., 908 F. Supp. 718 (C.D. Cal. 1995)","...rrors in its opposition to the motion to dismiss. The relevance of two of Plaintiff's cited cases—In re Daou Systems, Inc., 411 F.3d 1006 (9th Cir. 2005) and S.E.C. v. Cross Financial Services, Inc., 908 F. Supp. 718 (C.D. Cal. 1995)—appears to be tenuous. Counsel states that he cited to In re Da",uncertain,"S.E.C. v. Cross Financial Services, Inc.",S.E.C.,"Cross Financial Services, Inc.",908,F. Supp.,718,cacd,1995,,,,FALSE,,,,,,,,,,
flowz_digital_llc_v_flowz_staffing_llc_5-30-2025_order.pdf,"Shell Petroleum N.V. v. Republic of Costa Rica, 608 F. Supp. 2d 269 (S.D.N.Y. 2009)","...t where S.E.C. did not allege that defendant had violated the securities laws). Moreover, after multiple search attempts, the Court is unable to locate Shell Petroleum N.V. v. Republic of Costa Rica, 608 F. Supp. 2d 269 (S.D.N.Y. 2009). Plaintiff shall attach the case to its response to this orde",uncertain,Shell Petroleum N.V. v. Republic of Costa Rica,Shell Petroleum N.V.,Republic of Costa Rica,608,F. Supp. 2d,269,nysd,2009,,,,FALSE,,,NOT_FOUND,0.0,,,e697e44,approved,confirmed hallucination,
flowz_digital_llc_v_flowz_staffing_llc_5-30-2025_order.pdf,"Gell v. Hartmarx Corp., 496 U.S. 384 (U.S. 1988)","...es District Judge 1 Although this case has been stayed and administratively closed for docket- management purposes, the Court retains jurisdiction to issue sanctions. Cooter & Gell v. Hartmarx Corp., 496 U.S. 384, 395 (1990) (""It is well established that a federal court may consider collateral is",uncertain,Gell v. Hartmarx Corp.,Gell,Hartmarx Corp.,496,U.S.,384,usjc,1988,,,,FALSE,,,,,,,,,,
flowz_digital_llc_v_flowz_staffing_llc_5-30-2025_order.pdf,"United Energy Owners Comm., Inc. v. U.S. Energy Mgmt. Sys., Inc., 837 F.2d 356 (9th Cir. 1988)","...384, 395 (1990) (""It is well established that a federal court may consider collateral issues after an action is no longer pending.""); United Energy Owners Comm., Inc. v. U.S. Energy Mgmt. Sys., Inc., 837 F.2d 356, 358 (9th Cir. 1988) (noting that district court had jurisdiction to impose sanction",uncertain,"United Energy Owners Commission., Inc. v. U.S. Energy Mgmt. Sys., Inc.","United Energy Owners Commission., Inc.","U.S. Energy Mgmt. Sys., Inc.",837,F.2d,356,ca9,1988,,,,FALSE,,,,,,,,,,
gonzalez_v_texas_taxpayer_and_research_association_01-29-2005_order.pdf,"F.D.I.C. v. Maxxam, Inc., 523 F.3d 566 (5th Cir. 2008)","...s when deciding whether to impose sanctions. First, it may impose sanctions as a valid exercise of its inherent power. Chambers v. NASCO, 501 U.S. 32, 46–51 (1991); see also F.D.I.C. v. Maxxam, Inc., 523 F.3d 566, 585 (5th Cir. 2008) (quoting Natural Gas Pipeline Co. v. Energy Gathering, 2 F.3d 1",likely_real,"F.D.I.C. v. Maxxam, Inc.",F.D.I.C.,"Maxxam, Inc.",523,F.3d,566,ca5,2008,,,,FALSE,,,VERIFIED,1,https://www.courtlistener.com/opinion/59418/federal-deposit-insurance-v-maxxam-inc/,"Federal Deposit Insurance v. Maxxam, Inc.",e64568a,approved,,
gonzalez_v_texas_taxpayer_and_research_association_01-29-2005_order.pdf,"Natural Gas Pipeline Co. v. Energy Gathering, 2 F.3d 1397 (5th Cir. 1993)","...ercise of its inherent power. Chambers v. NASCO, 501 U.S. 32, 46–51 (1991); see also F.D.I.C. v. Maxxam, Inc., 523 F.3d 566, 585 (5th Cir. 2008) (quoting Natural Gas Pipeline Co. v. Energy Gathering, 2 F.3d 1397, 1410 (5th Cir. 1993)) (a ""party's 'evasiveness and intransigence' in disobeying cour",likely_real,Natural Gas Pipeline Co. v. Energy Gathering,Natural Gas Pipeline Co.,Energy Gathering,2,F.3d,1397,ca5,1993,,,,FALSE,,,VERIFIED,1,https://www.courtlistener.com/opinion/628611/natural-gas-pipeline-company-of-america-natural-gas-pipeline-company-of/,"Natural Gas Pipeline Company of America, Natural Gas Pipeline Company of America v. Energy Gathering, Inc., John Fox, Movant-Appellant",a0a9afc,approved,,
gonzalez_v_texas_taxpayer_and_research_association_01-29-2005_order.pdf,"Conner v. Travis Cnty., 209 F.3d 794 (5th Cir. 2000)","...F.3d 1397, 1410 (5th Cir. 1993)) (a ""party's 'evasiveness and intransigence' in disobeying court orders 'justifie[s] sanctions' under a court's inherent power""); see generally Conner v. Travis Cnty., 209 F.3d 794, 800 (5th Cir. 2000) (""The purpose of a court's sanctioning power is to enable it to",likely_real,Conner v. Travis County.,Conner,Travis County.,209,F.3d,794,ca5,2000,,,,FALSE,,,VERIFIED,1,https://www.courtlistener.com/opinion/20715/conner-v-travis-county/,Conner v. Travis County,fbdbb4a,approved,,
gonzalez_v_texas_taxpayer_and_research_association_01-29-2005_order.pdf,"Miller v. City of Los Angeles, 661 F.3d 1024 (9th Cir. 2011)","...uit law permits district courts to impose ""'petty fines"" as noncompensatory sanctions in a ""summary manner."" Crowe v. Smith, 151 F.3d 217, 228 (5th Cir. 1998); see also Miller v. City of Los Angeles, 661 F.3d 1024, 1030 (9th Cir. 2011) (citing Crowe, 151 F.3d at 227–29) (small noncompensatory san",likely_real,Miller v. City of Los Angeles,Miller,City of Los Angeles,661,F.3d,1024,ca9,2011,,,,FALSE,,,VERIFIED,1,https://www.courtlistener.com/opinion/616194/miller-v-city-of-los-angeles/,Miller v. City of Los Angeles,3fbf7a8,approved,,
gonzalez_v_texas_taxpayer_and_research_association_01-29-2005_order.pdf,"Cruz v. Aramark Servs., Inc., 213 F. Supp. 2d 135 (D.P.R. 2002)","...), which do not exist. (See Resp., Dkt. 6, at 13,, 17, 22). He also references cases with different citations and unrelated propositions for which he cites, including: • Cruz v. Aramark Servs., Inc., 213 F. Supp. 2d 135, 139 (D.P.R. 2002), representing the holding as ""denying a motion to dismiss ",likely_real,"Cruz v. Aramark Services., Inc.",Cruz,"Aramark Services., Inc.",213,F. Supp. 2d,135,prd,2002,,,,FALSE,,,,,,,,,,
gonzalez_v_texas_taxpayer_and_research_association_01-29-2005_order.pdf,"Chambers v. NASCO, 501 U.S. 32 (U.S. 2008)","...malicious. (Id.). The Court may draw on a number of authorities when deciding whether to impose sanctions. First, it may impose sanctions as a valid exercise of its inherent power. Chambers v. NASCO, 501 U.S. 32, 46–51 (1991); see also F.D.I.C. v. Maxxam, Inc., 523 F.3d 566, 585 (5th Cir. 2008) (",uncertain,Chambers v. NASCO,Chambers,NASCO,501,U.S.,32,usjc,2008,,,,FALSE,,,VERIFIED,1,https://www.courtlistener.com/opinion/112616/chambers-v-nasco-inc/,"Chambers v. Nasco, Inc.",3fbf7a8,approved,,
gonzalez_v_texas_taxpayer_and_research_association_01-29-2005_order.pdf,"Crowe v. Smith, 151 F.3d 217 (5th Cir. 1998)","...is to enable it to ensure its own proper functioning.""). Second, Fifth Circuit law permits district courts to impose ""'petty fines"" as noncompensatory sanctions in a ""summary manner."" Crowe v. Smith, 151 F.3d 217, 228 (5th Cir. 1998); see also Miller v. City of Los Angeles, 661 F.3d 1024, 1030 (9",uncertain,Crowe v. Smith,Crowe,Smith,151,F.3d,217,ca5,1998,,,,FALSE,,,,,,,,,,
gonzalez_v_texas_taxpayer_and_research_association_01-29-2005_order.pdf,"Edwards v. General Motors Corp., 153 F.3d 242 (5th Cir. 1998)","...ses""). Third, the Court may look to statutory authority if ""evidence of bad faith, improper motive, or reckless disregard of the duty owed to the court"" are involved. Edwards v. General Motors Corp., 153 F.3d 242, 246 (5th Cir. 1998); 28 U.S.C. § 1927 (""Any attorney . . . who so multiplies the pr",uncertain,Edwards v. General Motors Corp.,Edwards,General Motors Corp.,153,F.3d,242,ca5,1998,,,,FALSE,,,VERIFIED,1.0,https://www.courtlistener.com/opinion/15646/edwards-v-general-motors-corp/,Edwards v. General Motors Corp.,e697e44,approved,,
gonzalez_v_texas_taxpayer_and_research_association_01-29-2005_order.pdf,"Bloomberg L.P. v. Bd. of Govs. of the Fed. Reserve Sys., 649 F. 3d 651 (D.C. Cir. 2011)","...n abundance of technical and substantive errors that inhibited TTRA's ability to efficiently reply to his Response. For example, Pittman cites Bloomberg L.P. v. Bd. of Govs. of the Fed. Reserve Sys., 649 F. 3d 651, 657 (D.C. Cir. 2011), Hogan v. AT&T, Inc., 917 F. Supp. 1275, 1280 (S.D. Tex. 1994",uncertain,Bloomberg L.P. v. Board. of Govs. of the Fed. Reserve Sys.,Bloomberg L.P.,Board. of Govs. of the Fed. Reserve Sys.,649,F.3d,651,cadc,2011,,,,FALSE,,,,,,,,,,
gonzalez_v_texas_taxpayer_and_research_association_01-29-2005_order.pdf,"Hogan v. AT&T, Inc., 917 F. Supp. 1275 (S.D. Tex. 1994)","...ited TTRA's ability to efficiently reply to his Response. For example, Pittman cites Bloomberg L.P. v. Bd. of Govs. of the Fed. Reserve Sys., 649 F. 3d 651, 657 (D.C. Cir. 2011), Hogan v. AT&T, Inc., 917 F. Supp. 1275, 1280 (S.D. Tex. 1994), and Head v. Chicora Life Ctr., LLC, 290 F. Supp. 3d 883",uncertain,"Hogan v. AT&T, Inc.",Hogan,"AT&T, Inc.",917,F. Supp.,1275,txsd,1994,,,,FALSE,,,,,,,,,,
gonzalez_v_texas_taxpayer_and_research_association_01-29-2005_order.pdf,"Head v. Chicora Life Ctr., LLC, 290 F. Supp. 3d 883 (S.D. Tex. 2018)","... cites Bloomberg L.P. v. Bd. of Govs. of the Fed. Reserve Sys., 649 F. 3d 651, 657 (D.C. Cir. 2011), Hogan v. AT&T, Inc., 917 F. Supp. 1275, 1280 (S.D. Tex. 1994), and Head v. Chicora Life Ctr., LLC, 290 F. Supp. 3d 883, 893 (S.D. Tex. 2018), which do not exist. (See Resp., Dkt. 6, at 13,, 17, 22",uncertain,"Head v. Chicora Life Center., LLC",Head,"Chicora Life Center., LLC",290,F. Supp. 3d,883,txsd,2018,,,,FALSE,,,,,,,,,,
gonzalez_v_texas_taxpayer_and_research_association_01-29-2005_order.pdf,"TIG Ins. Co. v. Carter, 640 S.W. 2d 232 (tex 1982)","...Cruz v. Aramark, but it was in a different reporter, by a different court, and a later year. And that case does not address the numerosity requirement in Title VII or TCHRA. • TIG Ins. Co. v. Carter, 640 S.W. 2d 232, 237 (Tex. 1982), representing that the court ""held that a plaintiff's allegation",uncertain,TIG Insurance. Co. v. Carter,TIG Insurance. Co.,Carter,640,S.W.2d,232,tex,1982,,,,FALSE,,,,,,,,,,
gonzalez_v_texas_taxpayer_and_research_association_01-29-2005_order.pdf,"TIG Ins. Co. v. Carter, 640 S.W. 2d 232 (Tex. 1982),","...Cruz v. Aramark, but it was in a different reporter, by a different court, and a later year. And that case does not address the numerosity requirement in Title VII or TCHRA. • TIG Ins. Co. v. Carter, 640 S.W. 2d 232, 237 (Tex. 1982), representing that the court ""held that a plaintiff's allegation",uncertain,TIG Insurance. Co. v. Carter,TIG Insurance. Co.,Carter,640,S.W.2d,232,tex,1982,,,,FALSE,,,,,,,,,,
gov.uscourts.mied.376829.74.0.pdf,"Pliler v. Ford, 542 U.S. 225 (U.S. 2004)","...ent…is beyond the purview of the court's judicial role and can result in the subversion of the court's neutrality."" In re McFadden, 477 B.R. 686, 690 (Bankr. N.D. Ohio 2012); see also Pliler v. Ford, 542 U.S. 225, 226 (2004) (""Requiring district courts to advise pro se litigants…would undermine d",likely_real,Pliler v. Ford,Pliler,Ford,542,U.S.,225,usjc,2004,,,,FALSE,,,VERIFIED,1,https://www.courtlistener.com/opinion/136992/pliler-v-ford/,Pliler v. Ford,e64568a,approved,,
gov.uscourts.mied.376829.74.0.pdf,"McPherson v. Kelsey, 125 F.3d 989 (6th Cir. 1997)","...rict judges' role as impartial decisionmakers.""). And because Hardy fails to support his requests for relief with legal analysis, he waives any right to the requested relief. See McPherson v. Kelsey, 125 F.3d 989, 995-996 (6th Cir. 1997) (""Issues adverted to in a perfunctory manner"" are ""deemed w",likely_real,McPherson v. Kelsey,McPherson,Kelsey,125,F.3d,989,ca6,1997,,,,FALSE,,,VERIFIED,1,https://www.courtlistener.com/opinion/7053399/mcpherson-v-kelsey/,McPherson v. Kelsey,a0a9afc,approved,,
gov.uscourts.mied.376829.74.0.pdf,"Anderson v. Furst, No. 17-cv-12676, 2018 WL 4407750 (E.D. Mich. Sept. 17, 2018)","...uest, answer, response, and objection which is the subject of the motion or a copy of the actual discovery document which is the subject of the motion.""); see also Anderson v. Furst, No. 17-cv-12676, 2018 WL 4407750, at *2 (E.D. Mich. Sept. 17, 2018) (denying motion that ""fail[ed] to either recit",likely_real,Anderson v. Furst,Anderson,Furst,2018,WL,4407750,mied,2018,9,17,17-cv-12676,TRUE,4407750,,LIKELY_REAL,0.95,https://www.courtlistener.com/docket/6264209/54/anderson-v-furst/,Anderson v. Furst,fbdbb4a,approved,correct document,
gov.uscourts.mied.376829.74.0.pdf,"Moderwell v. Cuyahoga Cty., 997 F.3d 653 (6th Cir. 2021)","... (emphasis added). But when considering a Rule 12(c) motion, the Court must accept as true ""all well- pleaded material allegations of the pleadings of the opposing party."" Moderwell v. Cuyahoga Cty., 997 F.3d 653, 659 (6th Cir. 2021) (cleaned up, emphasis added). Despite filing dozens of lawsuits",uncertain,Moderwell v. Cuyahoga County.,Moderwell,Cuyahoga County.,997,F.3d,653,ca6,2021,,,,FALSE,,,,,,,,,,
gov.uscourts.mied.376829.74.0.pdf,"Ins. Co. v. Shepard, No. 19-cv-12777, 2021 WL 1087416 (E.D. Mich. Mar. 22, 2021)","... 71. His filing of an extra reply brief violated E.D. Mich. LR 7.1(d)(1), which authorizes only a response brief and a reply brief to a motion. Acceptance Indem. Ins. Co. v. Shepard, No. 19-cv-12777, 2021 WL 1087416, at *7 (E.D. Mich. Mar. 22, 2021) (defendant violated ""Local Rule 7.1(d) by filin",uncertain,Insurance. Co. v. Shepard,Insurance. Co.,Shepard,2021,WL,1087416,mied,2021,3,22,19-cv-12777,TRUE,1087416,,,,,,,,,
gov.uscourts.mied.376829.74.0.pdf,"Moore v. Hillman, No. 4:06-CV-43, 2006 WL 1313880 (W.D. Mich. May 12, 2006)","... that these 4 Case 2:24-cv-11190-LVP-EAS ECF No. 74, PageID.698 Filed 01/28/26 Page 5 of 9 resources are allocated in a way that promotes the interests of justice."" Moore v. Hillman, No. 4:06-CV-43, 2006 WL 1313880, at *4 (W.D. Mich. May 12, 2006). Hardy's pro se status does not give him license ",uncertain,Moore v. Hillman,Moore,Hillman,2006,WL,1313880,miwd,2006,5,12,4:06-CV-43,TRUE,1313880,,LIKELY_REAL,0.95,https://www.courtlistener.com/docket/4697246/7/moore-v-hillman/,Moore v. Hillman,e697e44,approved,,
gov.uscourts.mied.376829.74.0.pdf,"Bradley v. Wallrad, No. 1:06 cv 246, 2006 WL 1133220 (S.D. Ohio Apr. 27, 2006) ","...12, 2006). Hardy's pro se status does not give him license ""to clog the judicial machinery with meritless litigation, and abuse already overloaded court dockets."" Bradley v. Wallrad, No. 1:06 cv 246, 2006 WL 1133220, at *1 n. 2 (S.D. Ohio Apr. 27, 2006) (cleaned up). Hardy is WARNED that his cont",uncertain,Bradley v. Wallrad,Bradley,Wallrad,2006,WL,1133220,ohsd,2006,4,27,1:06,TRUE,1133220,,,,,,,,,
gov.uscourts.mied.376829.74.0.pdf,"In re McFadden, 477 B.R. 686 (ohnb 2012)","... No. 74, PageID.699 Filed 01/28/26 Page 6 of 9 plausible legal argument…is beyond the purview of the court's judicial role and can result in the subversion of the court's neutrality."" In re McFadden, 477 B.R. 686, 690 (Bankr. N.D. Ohio 2012); see also Pliler v. Ford, 542 U.S. 225, 226 (2004) (""Re",uncertain,In re McFadden,,,477,B.R.,686,ohnb,2012,,,,FALSE,,,VERIFIED,1.0,https://www.courtlistener.com/opinion/8522565/in-re-mcfadden/,In re McFadden,e697e44,approved,,
gov.uscourts.mied.376829.74.0.pdf,"Moore v. Ford Motor co.,755 F.2d 510 (6th Cir. 1985)","...he most skeletal way, leaving the court to…put flesh on its bones."" (cleaned up)). Making matters worse, Hardy's brief includes fake citations. ECF No. 59, PageID.413 (citing ""Moore v. Ford Motor co.,755 F.2d 510, 513 (6th Cir. 1985)"" and ""Gibbs v. Wright, 2020 WL 1877661, at *2 (E.D. Tenn. Apr. ",uncertain,"Moore v. Ford Motor co.,755 F.2d",,,755,F.2d,510,ca6,1985,,,,FALSE,,,,,,,,,,
gov.uscourts.mied.376829.74.0.pdf,"Gibbs v. Wright, 2020 WL 1877661 (E.D. Tenn. Apr. 15, 2020)","...ts bones."" (cleaned up)). Making matters worse, Hardy's brief includes fake citations. ECF No. 59, PageID.413 (citing ""Moore v. Ford Motor co.,755 F.2d 510, 513 (6th Cir. 1985)"" and ""Gibbs v. Wright, 2020 WL 1877661, at *2 (E.D. Tenn. Apr. 15, 2020)""). The Court suspects that the fake citations r",uncertain,Gibbs v. Wright,Gibbs,Wright,2020,WL,1877661,tned,2020,4,15,,TRUE,1877661,,POSSIBLE_MATCH,0.4291,https://www.courtlistener.com/docket/28273838/408/united-states-v-draughn/,United States v. Draughn,e697e44,,,
gov.uscourts.mied.376829.74.0.pdf,"Smart v. Pro. Grp., No. 4:25-cv-11833, 2025 WL 3091139 (E.D. Mich. Nov. 5, 2025)","...faith, Rule 11 6 Case 2:24-cv-11190-LVP-EAS ECF No. 74, PageID.700 Filed 01/28/26 Page 7 of 9 sanctions for use of AI generated phantom cases may be warranted. Smart v. Pro. Grp., No. 4:25-cv-11833, 2025 WL 3091139, at *5 (E.D. Mich. Nov. 5, 2025). D. Hardy moves to compel defendants to produce d",uncertain,Smart v. Pro. Grp.,Smart,Pro. Grp.,2025,WL,3091139,mied,2025,11,5,4:25-cv-11833,TRUE,3091139,,POSSIBLE_MATCH,0.6012,https://www.courtlistener.com/docket/70612920/38/smart-v-the-professional-group/,Smart v. The Professional Group,cc46446,approved,,
gov.uscourts.mied.376829.74.0.pdf,"In re Tenn. Dep't of Homeland Sec., 985 F3d 544 (6th Cir. 2021)","...defendants have ""submitted some"" but not all the documents he requested. Id., PageID.438. Hardy's motion again includes fake citations. Id., PageID.440 (citing ""Jones v. Tenn. Dep't of Homeland Sec., 985 F3d 544, 550 (6th Cir. 2021)"" and ""McCarthy v. Ameritech Publ'g Inc., 763 F3d 619, 629 (6th C",uncertain,In re Tenn. Department of Homeland Sec.,,,985,F.3d,544,ca6,2021,,,,FALSE,,,,,,,,,,
gov.uscourts.mied.376829.74.0.pdf,"In re Ameritech Publ'g Inc., 763 F3d 619 (6th Cir. 2014)","...d., PageID.438. Hardy's motion again includes fake citations. Id., PageID.440 (citing ""Jones v. Tenn. Dep't of Homeland Sec., 985 F3d 544, 550 (6th Cir. 2021)"" and ""McCarthy v. Ameritech Publ'g Inc., 763 F3d 619, 629 (6th Cir. 2014)""). And Hardy's motion fails to comply with the local rules. E.D.",uncertain,In re Ameritech Publ'g Inc.,,,763,F.3d,619,ca6,2014,,,,FALSE,,,,,,,,,,
lacey_v_state_farm_general_insurance_co_5-6-2025_order.pdf,"United States v. Cohen, 724 F.Supp.3d 251 (S.D.N.Y. 2024)","...ility for doing so – is just another example of Saxena's abusive litigation tactics, and further explains why the court issued case-terminating sanctions"") (collecting cases); United States v. Cohen, 724 F.Supp.3d 251, 254, 259 (S.D.N.Y 2024) (declining to find bad faith where defense lawyer volu",likely_fake,United States v. Cohen,United States,Cohen,724,F. Supp. 3d,251,nysd,2024,,,,FALSE,,,LIKELY_REAL,0.9,https://www.courtlistener.com/docket/67080327/152/united-states-v-cohen/,United States v. COHEN,cc46446,investigate,"right case, wrong document",
lacey_v_state_farm_general_insurance_co_5-6-2025_order.pdf,"National Steel Products Co. v. Superior, 164 Cal.App.3d 476 (1985)","...e the adjusters' recommendations, pending activities, and discussion with other State Farm claims representatives regarding the Lacey's insurance claim. National Steel Products Co. v. Superior Court, 164 Cal.App.3d 476, 489 (1985) (""Internal memoranda or claims file materials, although they may d",likely_fake,National Steel Products Co. v. Superior,National Steel Products Co.,Superior,164,Cal. App. 3d,476,calctapp,1985,,,,FALSE,,,VERIFIED,1,https://www.courtlistener.com/opinion/2120058/national-steel-products-co-v-superior-court/,National Steel Products Co. v. Superior Court,e64568a,approved,,
lacey_v_state_farm_general_insurance_co_5-6-2025_order.pdf,"Products Co. v. Superior, 164 Cal.App.3d 476 (1985)","...e the adjusters' recommendations, pending activities, and discussion with other State Farm claims representatives regarding the Lacey's insurance claim. National Steel Products Co. v. Superior Court, 164 Cal.App.3d 476, 489 (1985) (""Internal memoranda or claims file materials, although they may d",likely_fake,Products Co. v. Superior,Products Co.,Superior,164,Cal. App. 3d,476,calctapp,1985,,,,FALSE,,,VERIFIED,1,https://www.courtlistener.com/opinion/2120058/national-steel-products-co-v-superior-court/,National Steel Products Co. v. Superior Court,e64568a,approved,,
lacey_v_state_farm_general_insurance_co_5-6-2025_order.pdf,"Zambrano v. City of Tustin, 885 F.2d 1473 (9th Cir. 1989)","...he Ninth Circuit has long held that ""[i]n determining the validity of any 13 judicial sanction, we must first consider the underlying authority for the court's 14 action."" Zambrano v. City of Tustin, 885 F.2d 1473, 1476 (9th Cir. 1989). ""For a 15 sanction to be validly imposed, the conduct in que",likely_fake,Zambrano v. City of Tustin,Zambrano,City of Tustin,885,F.2d,1473,ca9,1989,,,,FALSE,,,,,,,,,,
lacey_v_state_farm_general_insurance_co_5-6-2025_order.pdf,"U.S. v. Stoneberger, 805 F.2d 1391(9th Cir. 1986)","...t's inherent authority, the target ""must 20 have 'engaged in bad faith or willful disobedience of a court's order.'"" Fink v. 21 Gomez, 239 F.3d 989, 992 (9th Cir. 2001); see also U.S. v. Stoneberger, 805 F.2d 22 1391, 1393 (9th Cir. 1986) (""A specific finding of bad faith...must 'precede any 23 s",likely_fake,U.S. v. Stoneberger,U.S.,Stoneberger,805,F.2d,22,ca9,1986,,,,FALSE,,,VERIFIED,1,https://www.courtlistener.com/opinion/479835/united-states-v-ernest-stoneberger-and-james-l-buchanan-ii/,"United States v. Ernest Stoneberger, and James L. Buchanan II",fbdbb4a,approved,,
lacey_v_state_farm_general_insurance_co_5-6-2025_order.pdf,"United States v. Cohen, 724 F. Supp. 3d 251 (S.D.N.Y. 2024)","...erent powers.'"") (citations omitted). As detailed 24 above, there is no bad faith here, and thus sanctions under the Court's inherent 25 powers are not appropriate. See, e.g., United States v. Cohen, 724 F. Supp. 3d 251, 26 258 (S.D.N.Y. 2024) (declining to impose sanctions upon attorney for mist",likely_fake,United States v. Cohen,United States,Cohen,724,F. Supp. 3d,251,nysd,2024,,,,FALSE,,,NOT_FOUND,0,,,3fbf7a8,duplicate,duplicate of line 272,
lacey_v_state_farm_general_insurance_co_5-6-2025_order.pdf,"Mata v. Avianca, 678 F. Supp. 3d 443 (S.D.N.Y. 2023)","...ons against attorney who declined to admit use of AI and persisted in asserting the validity of non-existent cases despite opposition that expressly raised fictitious case concerns); Mata v. Avianca, 678 F. Supp. 3d 443, 466 (S.D.N.Y. 2023). Likewise, for Rule 11: where, as here, the proposed san",likely_fake,Mata v. Avianca,Mata,Avianca,678,F. Supp. 3d,443,nysd,2023,,,,FALSE,,,LIKELY_REAL,0.9,https://www.courtlistener.com/docket/63107798/59/mata-v-avianca-inc/,"Mata v. Avianca, Inc.",ff0a91d,,,
lacey_v_state_farm_general_insurance_co_5-6-2025_order.pdf,"United National Ins. Co. v. R&D Latex Corp., 242 F.3d 1102 (9th Cir. 2001)","... (S.D.N.Y. 2023). Likewise, for Rule 11: where, as here, the proposed sanction is imposed sua sponte, a finding of bad faith is a prerequisite. See, e.g., United National Ins. Co. v. R&D Latex Corp., 242 F.3d 1102, 1116 (9th Cir. 2001) (""sua sponte sanctions 'will ordinarily be imposed only in si",likely_fake,United National Insurance. Co. v. R&D Latex Corp.,United National Insurance. Co.,R&D Latex Corp.,242,F.3d,1102,ca9,2001,,,,FALSE,,,VERIFIED,1,https://www.courtlistener.com/opinion/7088792/united-national-insurance-v-rd-latex-corp/,United National Insurance v. R&D Latex Corp.,3fbf7a8,approved,,
lacey_v_state_farm_general_insurance_co_5-6-2025_order.pdf,"Barber v. Miller, 146, 27 F.3d 707 (9th Cir. 1998)","...6 fees to the opposing party, given the provision in Rule 11(c)(4) that fee awards are only available ""if imposed on motion."" Fed. R. Civ. P. 11(c)(4) (emphasis added); see also Barber v. Miller, 146 27 F.3d 707, 711 (9th Cir. 1998); Nuwesra v. Merrill Lynch, Fenner & Smith, Inc., 174 F.3d 87, 94",likely_fake,Barber v. Miller,Barber,Miller,27,F.3d,707,ca9,1998,,,,FALSE,,,NOT_FOUND,0.0,,,e697e44,ignore,parsing issue,
lacey_v_state_farm_general_insurance_co_5-6-2025_order.pdf,"Nuwesra v. Merrill Lynch, Fenner & Smith, Inc., 174 F.3d 87 (bap2 1999)","... are only available ""if imposed on motion."" Fed. R. Civ. P. 11(c)(4) (emphasis added); see also Barber v. Miller, 146 27 F.3d 707, 711 (9th Cir. 1998); Nuwesra v. Merrill Lynch, Fenner & Smith, Inc., 174 F.3d 87, 94 (2nd Cir. 1999). 28 -3- PLAINTIFF'S RESPONSE TO SPECIAL MASTER'S NOTICE (filed Ap",likely_fake,"Nuwesra v. Merrill Lynch, Fenner & Smith, Inc.",Nuwesra,"Merrill Lynch, Fenner & Smith, Inc.",174,F.3d,87,,1999,,,,FALSE,,,VERIFIED,1.0,https://www.courtlistener.com/opinion/763324/lee-nuwesra-esq-ernesto-forbes-v-merrill-lynch-fenner-smith-inc/,"Lee Nuwesra, Esq., Ernesto Forbes v. Merrill Lynch, Fenner & Smith, Inc., Yolanda D'Apuzzo and Anthony Dibiase",e697e44,approved,,
