pdf,citation_text,context,classification,case_name,plaintiff,defendant,volume,reporter,page,court,year,month,day,docket_number,is_westlaw,wl_number,review_reason,v_status,v_confidence,v_url,v_matched_name,v_git_hash,qc_status,qc_notes,
melissa_wilcox_v._matthew_a._gingrich.pdf,"Ins. Co. v. United Auto. Ins. Co., 947 N.E.2d 382 (2011)","... Ct. App. 2011)"" (listed in Table of Authorities as appearing at page 18 of the brief, but actually appears on page 30). The actual citation leads to American Serv. Ins. Co. v. United Auto. Ins. Co., 947 N.E.2d 382 (Ill. Court of Appeals of Indiana | Opinion 25A-PL-1157 | January 30, 2026 Page 9 ",uncertain,Insurance. Co. v. United Auto. Insurance. Co.,Insurance. Co.,United Auto. Insurance. Co.,947,N.E.2d,382,,2011,,,,FALSE,,,,,,,,,,
melissa_wilcox_v._matthew_a._gingrich.pdf,"Heim v. Fletcher, 873 N.E.2d 725 (Ind. Ct. App. 2007)","...ns. Co., 947 N.E.2d 382 (Ill. Court of Appeals of Indiana | Opinion 25A-PL-1157 | January 30, 2026 Page 9 of 19 App. 2011). No case named ""Gosman v. State Farm"" exists in Indiana; ""Heim v. Fletcher, 873 N.E.2d 725 (Ind. Ct. App. 2007)"" (listed in Table of Authorities as appearing at page 25 of th",uncertain,Heim v. Fletcher,Heim,Fletcher,873,N.E.2d,725,indctapp,2007,,,,FALSE,,,,,,,,,,
melissa_wilcox_v._matthew_a._gingrich.pdf,"Jones v. State, 873 N.E.2d 725 (indctapp 2007)","...ns. Co., 947 N.E.2d 382 (Ill. Court of Appeals of Indiana | Opinion 25A-PL-1157 | January 30, 2026 Page 9 of 19 App. 2011). No case named ""Gosman v. State Farm"" exists in Indiana; ""Heim v. Fletcher, 873 N.E.2d 725 (Ind. Ct. App. 2007)"" (listed in Table of Authorities as appearing at page 25 of th",uncertain,Jones v. State,Jones,State,873,N.E.2d,725,indctapp,2007,,,,FALSE,,,VERIFIED,1.0,https://www.courtlistener.com/opinion/2107043/jones-v-state/,Jones v. State,e697e44,approved,,
melissa_wilcox_v._matthew_a._gingrich.pdf,"People v. Urdiales, 871 N.E.2d 669 (ill 2007)","...871 N.E.2d 725 (Ind. Ct. App. 2007)"" (does not appear in the Table of Authorities, but is cited in the brief at page 35 for fraud evidence standards). The actual citation leads to People v. Urdiales, 871 N.E.2d 669 (Ill. 2007). No case named ""Helmsing v. Fletcher"" exists in Indiana; ""Kovach v. St",uncertain,People v. Urdiales,People,Urdiales,871,N.E.2d,669,ill,2007,,,,FALSE,,,VERIFIED,1.0,https://www.courtlistener.com/opinion/2219951/people-v-urdiales/,People v. Urdiales,e697e44,approved,,
melissa_wilcox_v._matthew_a._gingrich.pdf,"Kovach v. State, 992 N.E.2d 409 (Ind. 2013)","... brief at page 35 for fraud evidence standards). The actual citation leads to People v. Urdiales, 871 N.E.2d 669 (Ill. 2007). No case named ""Helmsing v. Fletcher"" exists in Indiana; ""Kovach v. State, 992 N.E.2d 409 (Ind. 2013)"" (listed in the Table of Authorities as appearing at page 34, but is c",uncertain,Kovach v. State,Kovach,State,992,N.E.2d,409,ind,2013,,,,FALSE,,,,,,,,,,
melissa_wilcox_v._matthew_a._gingrich.pdf,"In re Dashawn W., 992 N.E.2d 402 (nyappdiv 2013)","... (Ind. 2013)"" (listed in the Table of Authorities as appearing at page 34, but is cited at page 43 of the brief for cumulative error analysis standard). The actual citation leads to In re Dashawn W., 992 N.E.2d 402 (N.Y. App. Div. 2013). No case named ""Kovach v. State"" exists in Indiana; ""Patton ",uncertain,In re Dashawn W.,,,992,N.E.2d,402,nyappdiv,2013,,,,FALSE,,,,,,,,,,
melissa_wilcox_v._matthew_a._gingrich.pdf,"Patton v. ALCOA, 861 N.E.2d 232 (Ind. Ct. App. 2007)","...rief for cumulative error analysis standard). The actual citation leads to In re Dashawn W., 992 N.E.2d 402 (N.Y. App. Div. 2013). No case named ""Kovach v. State"" exists in Indiana; ""Patton v. ALCOA, 861 N.E.2d 232 (Ind. Ct. App. 2007)"" (listed in the Table of Authorities as appearing at pages 27",uncertain,Patton v. ALCOA,Patton,ALCOA,861,N.E.2d,232,indctapp,2007,,,,FALSE,,,NOT_FOUND,0.3462,https://www.courtlistener.com/docket/5307068/76/walker-v-alcoa-inc/,Walker v. ALCOA Inc,e64568a,approved,confirmed hallucination,
melissa_wilcox_v._matthew_a._gingrich.pdf,"Cook Cnty. v. Illinois Lab. Rels. Bd., 861 N.E.2d 231 (illappct 2006)","...d 34, but is cited at pages 39 and 44 of the brief involving discovery sanctions and exclusion of testimony). The actual citation leads to Forest Pres. Dist. of Cook Cnty. v. Illinois Lab. Rels. Bd., 861 N.E.2d 231 (Ill. App. 2006). No case named ""Patton v. ALCOA"" exists in Indiana; ""Oddi-Sampson",uncertain,Cook County. v. Illinois Lab. Rels. Board.,Cook County.,Illinois Lab. Rels. Board.,861,N.E.2d,231,illappct,2006,,,,FALSE,,,VERIFIED,1.0,https://www.courtlistener.com/opinion/2048111/forest-preserve-district-v-illinois-labor-relations-board/,Forest Preserve District v. Illinois Labor Relations Board,e697e44,approved,,
melissa_wilcox_v._matthew_a._gingrich.pdf,"Oddi-Sampson v. State, 201 N.E.3d 749 (Ind. 2022)",".... The actual citation leads to Forest Pres. Dist. of Cook Cnty. v. Illinois Lab. Rels. Bd., 861 N.E.2d 231 (Ill. App. 2006). No case named ""Patton v. ALCOA"" exists in Indiana; ""Oddi-Sampson v. State, 201 N.E.3d 749 (Ind. 2022)"" (listed in the Table of Authorities as appearing at page 4, but does ",uncertain,Oddi-Sampson v. State,Oddi-Sampson,State,201,N.E.3d,749,ind,2022,,,,FALSE,,,NOT_FOUND,0.2691,https://www.courtlistener.com/docket/29020846/50/garner-v-biden/,Garner v. Biden,cc46446,approved,confirmed hallucination,
melissa_wilcox_v._matthew_a._gingrich.pdf,"Commonwealth v. Kalila, 201 N.E.3d 748 (massappct 2023)","...e brief for the proposition that courts avoid absurd results). The actual citation Court of Appeals of Indiana | Opinion 25A-PL-1157 | January 30, 2026 Page 10 of 19 leads to Commonwealth v. Kalila, 201 N.E.3d 748 (Mass. App. Ct. 2023). No case named ""Oddi-Sampson v. State"" or ""State v. Oddi-Samp",uncertain,Commonwealth v. Kalila,Commonwealth,Kalila,201,N.E.3d,748,massappct,2023,,,,FALSE,,,POSSIBLE_MATCH,0.825,https://www.courtlistener.com/opinion/10271841/commonwealth-v-khalid-kalila/,COMMONWEALTH v. KHALID KALILA.,e697e44,approved,,
melissa_wilcox_v._matthew_a._gingrich.pdf,"Johnson v. State, 648 N.E.2d 666 (indctapp 1995)","...N.E.2d at 670"" (does not appear in the Table of Authorities, is not a full citation, and is cited at page 41 of the brief for expectation damages rule). The actual citation leads to Johnson v. State, 648 N.E.2d 666 (Ind. Ct. App. 1995). Without knowing the full case name, it is impossible to dete",uncertain,Johnson v. State,Johnson,State,648,N.E.2d,666,indctapp,1995,,,,FALSE,,,VERIFIED,1.0,https://www.courtlistener.com/opinion/2064122/johnson-v-state/,Johnson v. State,e697e44,approved,,
melissa_wilcox_v._matthew_a._gingrich.pdf,"Flick v. Reichert, 119 N.E.3d 1244 (Ind. Ct. App. 2019)","...ion leads to Johnson v. State, 648 N.E.2d 666 (Ind. Ct. App. 1995). Without knowing the full case name, it is impossible to determine whether the ""Clutter"" case exists in Indiana; ""Flick v. Reichert, 119 N.E.3d 1244 (Ind. Ct. App. 2019)"" (listed in the Table of Authorities as appearing at pages 2",uncertain,Flick v. Reichert,Flick,Reichert,119,N.E.3d,1244,indctapp,2019,,,,FALSE,,,,,,,,,,
melissa_wilcox_v._matthew_a._gingrich.pdf,"Harris v. Rubino, 119 N.E.3d 1238 (ohio 2019)","... (Ind. Ct. App. 2019)"" (listed in the Table of Authorities as appearing at pages 26 and 32, but is cited at pages 37 and 41 of the brief). The actual citation leads to State ex rel. Harris v. Rubino, 119 N.E.3d 1238 (Ohio 2019). No case named ""Flick v. Reichert"" exists in Indiana. 1.2. Mischaract",uncertain,Harris v. Rubino,Harris,Rubino,119,N.E.3d,1238,ohio,2019,,,,FALSE,,,,,,,,,,
melissa_wilcox_v._matthew_a._gingrich.pdf,"Harrison v. Thomas, 761 N.E.2d 816 (Ind. Ct. App. 2002)","...terized Real Cases Of the cases the Wilcoxes cite that do exist, many are incorrectly described or [22] cited for propositions they do not support. For example, the Wilcoxes cite ""Harrison v. Thomas, 761 N.E.2d 816 (Ind. Ct. App. 2002)"" in their Table of Authorities as appearing on page 27 and at",uncertain,Harrison v. Thomas,Harrison,Thomas,761,N.E.2d,816,indctapp,2002,,,,FALSE,,,,,,,,,,
melissa_wilcox_v._matthew_a._gingrich.pdf,"Harrison v. Thomas, 761 N.E.2d 816 (ind 2002)","...terized Real Cases Of the cases the Wilcoxes cite that do exist, many are incorrectly described or [22] cited for propositions they do not support. For example, the Wilcoxes cite ""Harrison v. Thomas, 761 N.E.2d 816 (Ind. Ct. App. 2002)"" in their Table of Authorities as appearing on page 27 and at",uncertain,Harrison v. Thomas,Harrison,Thomas,761,N.E.2d,816,ind,2002,,,,FALSE,,,,,,,,,,
melissa_wilcox_v._matthew_a._gingrich.pdf,"Kapoor v. Dybwad, 49 N.E.3d 108 (Ind. Ct. App. 2015)","...ving costs, or any holding about unproven costs equaling ""zero"" recovery. Court of Appeals of Indiana | Opinion 25A-PL-1157 | January 30, 2026 Page 11 of 19 [23] The Wilcoxes cite ""Kapoor v. Dybwad, 49 N.E.3d 108 (Ind. Ct. App. 2015)"" in their Table of Authorities as appearing on page 18 and at p",uncertain,Kapoor v. Dybwad,Kapoor,Dybwad,49,N.E.3d,108,indctapp,2015,,,,FALSE,,,VERIFIED,1.0,https://www.courtlistener.com/opinion/7167764/kapoor-v-dybwad/,Kapoor v. Dybwad,e697e44,approved,,
melissa_wilcox_v._matthew_a._gingrich.pdf,"Weber v. Costin, 654 N.E.2d 1130 (Ind. Ct. App. 1995)","...2(B)(6), which is conducted de novo. The case contains no discussion of jury verdicts, the clearly erroneous standard, or setting aside verdicts. [24] Like Kapoor, the Wilcoxes cite ""Weber v. Costin, 654 N.E.2d 1130"" at pages 30 and 34, not included in their Table of Authorities, for the proposit",uncertain,Weber v. Costin,Weber,Costin,654,N.E.2d,1130,indctapp,1995,,,,FALSE,,,,,,,,,,
melissa_wilcox_v._matthew_a._gingrich.pdf,"West v. State, 755 N.E.2d 173 (Ind. 2001)","..."" (Appellants' Br. at 34.) Weber addresses summary judgment on counts of fraud and waiver of right to trial by jury but does not address a jury's fraud verdict. [25] The Wilcoxes cite ""West v. State, 755 N.E.2d 173, 185 (Ind. 2001)"" at page 28, not included in the Table of Authorities, for the pr",uncertain,West v. State,West,State,755,N.E.2d,173,ind,2001,,,,FALSE,,,,,,,,,,
melissa_wilcox_v._matthew_a._gingrich.pdf,"Sweet Co., Inc. v. White County Bridge Commission, 714 N.E.2d 219 (indctapp 1999)","...al error doctrine has been applied. Court of Appeals of Indiana | Opinion 25A-PL-1157 | January 30, 2026 Page 12 of 19 [26] The Wilcoxes cite ""J.S. Sweet Co., Inc. v. White County Bridge Commission, 714 N.E.2d 219 (Ind. Ct. App. 1999)"" at page 39, not included in the Table of Authorities, for the",uncertain,"Sweet Co., Inc. v. White County Bridge Commission","Sweet Co., Inc.",White County Bridge Commission,714,N.E.2d,219,indctapp,1999,,,,FALSE,,,VERIFIED,1.0,https://www.courtlistener.com/opinion/2046283/js-sweet-co-v-white-county-bridge-commission/,J.S. Sweet Co. v. White County Bridge Commission,e697e44,approved,,
melissa_wilcox_v._matthew_a._gingrich.pdf,"Pierce v. State, 29 N.E.3d 1258 (Ind. 2015)","..."" The actual J.S. Sweet Co. case addresses mechanics' liens and prejudgment interest, and it contains no discussion of cost breakdowns in cost-plus contracts. [27] The Wilcoxes cite ""Pierce v. State, 29 N.E.3d 1258, 1271 (Ind. 2015)"" at page 43, not included in the Table of Authorities, for the p",uncertain,Pierce v. State,Pierce,State,29,N.E.3d,1258,ind,2015,,,,FALSE,,,,,,,,,,
melissa_wilcox_v._matthew_a._gingrich.pdf,"Motors, Inc. v. Benosky, 181 N.E.3d 857 (indctapp 2021)","...ally discusses sentencing of a credit- restricted felon in a child molesting case and includes no discussion of cumulative error doctrine. [28] The Wilcoxes also cite ""Butler Motors, Inc. v. Benosky, 181 N.E.3d 857 (Ind. Ct. App. 2021)"" in their Table of Authorities as appearing on page 3 and on ",uncertain,"Motors, Inc. v. Benosky","Motors, Inc.",Benosky,181,N.E.3d,857,indctapp,2021,,,,FALSE,,,NOT_FOUND,0.2613,https://www.courtlistener.com/docket/6433357/122/fox-yvonne-v-iowa-health-system/,"Fox, Yvonne v. Iowa Health System",e697e44,approved,confirmed hallucination.,
melissa_wilcox_v._matthew_a._gingrich.pdf,"Graves v. State, 773 N.E.2d 157 (ind 2002)",".... App. 1981), an Illinois criminal case about denial of a continuance request. No case named ""Lacy v. State"" was decided by the Indiana Supreme Court in 1981. The Wilcoxes also cite ""Graves v. State, 773 N.E.2d 157, 161 (Ind. 2002)"" [19] twice in their brief for the proposition that the ""trial ju",uncertain,Graves v. State,Graves,State,773,N.E.2d,157,ind,2002,,,,FALSE,,,POSSIBLE_MATCH,0.7,https://www.courtlistener.com/opinion/1613021/graves-v-state/,Graves v. State,cc46446,investigate,maybe too high - wrong court.,
melissa_wilcox_v._matthew_a._gingrich.pdf,"West v. State, 755 N.E.2d 173 (ind 2001)","..."" (Appellants' Br. at 34.) Weber addresses summary judgment on counts of fraud and waiver of right to trial by jury but does not address a jury's fraud verdict. [25] The Wilcoxes cite ""West v. State, 755 N.E.2d 173, 185 (Ind. 2001)"" at page 28, not included in the Table of Authorities, for the pr",uncertain,West v. State,West,State,755,N.E.2d,173,ind,2001,,,,FALSE,,,,,,,,,,
melissa_wilcox_v._matthew_a._gingrich.pdf,"Weber v. Costin, 654 N.E.2d 1130 (indctapp 1995)","...2(B)(6), which is conducted de novo. The case contains no discussion of jury verdicts, the clearly erroneous standard, or setting aside verdicts. [24] Like Kapoor, the Wilcoxes cite ""Weber v. Costin, 654 N.E.2d 1130"" at pages 30 and 34, not included in their Table of Authorities, for the proposit",uncertain,Weber v. Costin,Weber,Costin,654,N.E.2d,1130,indctapp,1995,,,,FALSE,,,,,,,,,,
melissa_wilcox_v._matthew_a._gingrich.pdf,"J.S. Sweet Co., Inc. v. White County Bridge Comm'n, 714 N.E.2d 219 (indctapp 1999)","...al error doctrine has been applied. Court of Appeals of Indiana | Opinion 25A-PL-1157 | January 30, 2026 Page 12 of 19 [26] The Wilcoxes cite ""J.S. Sweet Co., Inc. v. White County Bridge Commission, 714 N.E.2d 219 (Ind. Ct. App. 1999)"" at page 39, not included in the Table of Authorities, for the",uncertain,"J.S. Sweet Co., Inc. v. White County Bridge Commission","J.S. Sweet Co., Inc.",White County Bridge Commission,714,N.E.2d,219,indctapp,1999,,,,FALSE,,,VERIFIED,1.0,https://www.courtlistener.com/opinion/2046283/js-sweet-co-v-white-county-bridge-commission/,J.S. Sweet Co. v. White County Bridge Commission,e697e44,approved,,
melissa_wilcox_v._matthew_a._gingrich.pdf,"Pierce v. State, 29 N.E.3d 1258 (ind 2015)","..."" The actual J.S. Sweet Co. case addresses mechanics' liens and prejudgment interest, and it contains no discussion of cost breakdowns in cost-plus contracts. [27] The Wilcoxes cite ""Pierce v. State, 29 N.E.3d 1258, 1271 (Ind. 2015)"" at page 43, not included in the Table of Authorities, for the p",uncertain,Pierce v. State,Pierce,State,29,N.E.3d,1258,ind,2015,,,,FALSE,,,,,,,,,,
melissa_wilcox_v._matthew_a._gingrich.pdf,"Helmsing v. Fletcher, 871 N.E.2d 725 (indctapp 2007)","..., but is not actually cited in the brief). The actual citation leads to Jones v. State, 873 N.E.2d 725 (Ind. Ct. App. 2007). No case named ""Heim v. Fletcher"" exists in Indiana; ""Helmsing v. Fletcher, 871 N.E.2d 725 (Ind. Ct. App. 2007)"" (does not appear in the Table of Authorities, but is cited i",uncertain,Helmsing v. Fletcher,Helmsing,Fletcher,871,N.E.2d,725,indctapp,2007,,,,FALSE,,,NOT_FOUND,0,https://www.courtlistener.com/opinion/2219951/people-v-urdiales/,People v. Urdiales,a0a9afc,approved,confirmed hallucination,
mezu_v_mezu_10-29-2025_order.pdf,"Malone-Bey v. Lauderdale Cnty. Sch. Bd., No. 3:25-cv-380-KHJ-MTP, 2025 WL 2098352 (S.D. Miss. July 25, 2025)","...curate depictions of information from AI models that suffer from incomplete, biased, or otherwise flawed training data."" Id. (quoting Malone-Bey v. Lauderdale Cnty. Sch. Bd., No. 3:25-cv-380-KHJ-MTP, 2025 WL 2098352, at *4 (S.D. Miss., July 25, 2025)). The citation of fake cases in a brief or oth",likely_fake,Malone-Bey v. Lauderdale County. School. Board.,Malone-Bey,Lauderdale County. School. Board.,2025,WL,2098352,mssd,2025,7,25,3:25-cv-380-KHJ-MTP,TRUE,2098352,,LIKELY_REAL,0.9,https://www.courtlistener.com/docket/70381838/24/malone-bey-v-lauderdale-county-school-board/,Malone-Bey v. Lauderdale County School Board,fbdbb4a,approved,correct document,
mezu_v_mezu_10-29-2025_order.pdf,"Benjamin v. Costco Wholesale Corp., 779 F. Supp. 3d 341 (E.D.N.Y. 2025)","...e claims, defenses, and other legal contentions are warranted by existing law or by a nonfrivolous argument for extending, modifying, or reversing existing law or for establishing new law."" 7 Corp., 779 F. Supp. 3d 341, 347 (E.D.N.Y. 2025) (quoting Park v. Kim, 91 F.4th 610, 615 (2d Cir. 2024)). ",likely_fake,In re 7 Corp.,,,779,F. Supp. 3d,341,nyed,2025,,,,FALSE,,,POSSIBLE_MATCH,0.5294,https://www.courtlistener.com/docket/70553603/4/in-re-monogioudis/,In re Monogioudis,fbdbb4a,investigate; data,"document is incorrect, and match should not be so high confidence given difference in name and that we don't have exact date for docket document; but also FLP doesn't seem to have this document/opinion",
mezu_v_mezu_10-29-2025_order.pdf,"Att'y Grievance Comm'n v. Glenn, 341 Md. 448 (1996)","...rofessional obligations of the attorney."" As the Supreme Court of Maryland has explained, an attorney cannot escape responsibility for problems caused by an employee. Att'y Grievance Comm'n v. Glenn, 341 Md. 448, 479 (1996). An attorney must ascertain that all employees perform their responsibili",likely_fake,Att'y Grievance Commission v. Glenn,Att'y Grievance Commission,Glenn,341,Md.,448,md,1996,,,,FALSE,,,VERIFIED,1,https://www.courtlistener.com/opinion/1437677/attorney-grievance-commission-v-glenn/,Attorney Grievance Commission v. Glenn,a0a9afc,approved,,
mezu_v_mezu_10-29-2025_order.pdf,"Wadsworth v. Walmart Inc., 348 F.R.D. 489 (D. Wyo. 2025)","...n the client. See Benjamin, 779 F. Supp. 3d at 351 (sanction of $1,000 payable to the clerk of the court and order to serve a copy of the court's sanction order on client); Wadsworth v. Walmart Inc., 348 F.R.D. 489, 498 (D. Wyo. 2025) (revoke pro hac vice status and sanction of $3,000 payable to ",likely_real,Wadsworth v. Walmart Inc.,Wadsworth,Walmart Inc.,348,F.R.D.,489,wyd,2025,,,,FALSE,,,LIKELY_REAL,0.9,https://www.courtlistener.com/docket/67564066/212/wadsworth-v-walmart-inc/,Wadsworth v. Walmart Inc,ff0a91d,,,
mezu_v_mezu_10-29-2025_order.pdf,"Mungo v. State, 258 Md. App. 332 (2023)",".... See Rule 8-131(a) (an appellate court ordinarily will not decide an issue ""unless it plainly appears by the record to have been 27 raised in or decided by the trial court""). Accord Mungo v. State, 258 Md. App. 332, 369 (""Ordinarily, an appellate court will not decide any issue 'unless it plainl",likely_real,Mungo v. State,Mungo,State,258,Md. App.,332,mdctspecapp,2023,,,,FALSE,,,LIKELY_REAL,0.9,https://www.courtlistener.com/opinion/9415616/mungo-v-state/,Mungo v. State,a0a9afc,approved,,
mezu_v_mezu_10-29-2025_order.pdf,"Moore v. Md. Hemp Coal., No. 1590, 2025 WL 2602274 (2025)","... the parties were living together, and Father could see the children whenever he wanted. Arguably, a ruling on the issue of custody and visitation was not ripe. See Moore v. Md. Hemp Coal., No. 1590, 2025 WL 2602274, at *28 (Sept. 9, 2025) (""A claim is not yet ripe if 'it involves a request that ",likely_real,Moore v. Md. Hemp Coal.,Moore,Md. Hemp Coal.,2025,WL,2602274,,2025,,,1590,TRUE,2602274,,NOT_FOUND,0.3744,https://www.courtlistener.com/docket/70453363/30/charm-city-hemp-llc-v-moore/,"Charm City Hemp, LLC v. Moore",ff0a91d,,,
mezu_v_mezu_10-29-2025_order.pdf,"Noland v. Land of the Free, L.P., 336 Cal. Rptr. 3d 897 (calctapp 2025)","...lief there is good ground to support it."" 5 B. Analysis Recently, courts across the country have been presented with briefs containing ""fraudulent legal citations."" Noland v. Land of the Free, L.P., 336 Cal. Rptr. 3d 897, 911 (Cal. Ct. App. 2025). This case, however, appears to be the first where",uncertain,"Noland v. Land of the Free, L.P.",Noland,"Land of the Free, L.P.",336,Cal. Rptr. 3d,897,calctapp,2025,,,,FALSE,,,LIKELY_REAL,0.9,https://www.courtlistener.com/opinion/10670865/noland-v-land-of-the-free-lp/,"Noland v. Land of the Free, L.P.",e697e44,approved,,
mezu_v_mezu_10-29-2025_order.pdf,"United States v. Hayes, 763 F. Supp. 3d 1054 (E.D. Cal. 2025)","...across the country have issued sanctions against attorneys . . . for submitting fictitious case citations, fictitious quotations, and related misrepresentations to the court."" United States v. Hayes, 763 F. Supp. 3d 1054, 1071 (E.D. Cal. 2025). Courts have issued monetary sanctions, as well as re",uncertain,United States v. Hayes,United States,Hayes,763,F. Supp. 3d,1054,caed,2025,,,,FALSE,,,LIKELY_REAL,0.9,https://www.courtlistener.com/docket/69248764/75/united-states-v-hayes/,United States v. Hayes,e697e44,,,
mezu_v_mezu_10-29-2025_order.pdf,"Gauthier v. Goodyear Tire & Rubber Co., No. 1:23-CV-281, 2024 WL 4882651 (E.D. Tex. Nov. 25, 2024)","... v. Walmart Inc., 348 F.R.D. 489, 498 (D. Wyo. 2025) (revoke pro hac vice status and sanction of $3,000 payable to the Registry of the Court); Gauthier v. Goodyear Tire & Rubber Co., No. 1:23-CV-281, 2024 WL 4882651, at *3 (E.D. Tex. Nov. 25, 2024) (sanction of $2,000 as well as order to attend a",uncertain,Gauthier v. Goodyear Tire & Rubber Co.,Gauthier,Goodyear Tire & Rubber Co.,2024,WL,4882651,txed,2024,11,25,1:23-CV-281,TRUE,4882651,,LIKELY_REAL,0.95,https://www.courtlistener.com/docket/67624744/48/gauthier-v-goodyear-tire-rubber-co/,Gauthier v. Goodyear Tire & Rubber Co.,cc46446,approved,,
mezu_v_mezu_10-29-2025_order.pdf,"Keaau Dev. P'ship LLC v. Lawrence, 571 P.3d 958 (2025)","... clerk of the court and order to the clerk of the court to serve a copy of the opinion on the state bar association and for attorney to serve a copy on the client); Keaau Dev. P'ship LLC v. Lawrence, 571 P.3d 958, 960 (Haw. Ct. App. 2025) (monetary sanction of $100 to the clerk of the Supreme Cou",uncertain,Keaau Dev. P'ship LLC v. Lawrence,Keaau Dev. P'ship LLC,Lawrence,571,P.3d,958,,2025,,,,FALSE,,,,,,,,,,
mezu_v_mezu_10-29-2025_order.pdf,"Garner v. Kadince, Inc., 571 P.3d 812 (utahctapp 2025)","...orney to serve a copy on the client); Keaau Dev. P'ship LLC v. Lawrence, 571 P.3d 958, 960 (Haw. Ct. App. 2025) (monetary sanction of $100 to the clerk of the Supreme Court); Garner v. Kadince, Inc., 571 P.3d 812, 816 (Utah Ct. App. 2025) (order to refund all fees charged to counsel's client asso",uncertain,"Garner v. Kadince, Inc.",Garner,"Kadince, Inc.",571,P.3d,812,utahctapp,2025,,,,FALSE,,,LIKELY_REAL,0.9,https://www.courtlistener.com/opinion/10591984/garner-v-kadince/,Garner v. Kadince,e697e44,approved,,
mezu_v_mezu_10-29-2025_order.pdf,"Noland v. Land of the Free, 336 Cal. Rptr. 3d 897 (calctapp 2025)","...lief there is good ground to support it."" 5 B. Analysis Recently, courts across the country have been presented with briefs containing ""fraudulent legal citations."" Noland v. Land of the Free, L.P., 336 Cal. Rptr. 3d 897, 911 (Cal. Ct. App. 2025). This case, however, appears to be the first where",uncertain,Noland v. Land of the Free,Noland,Land of the Free,336,Cal. Rptr. 3d,897,calctapp,2025,,,,FALSE,,,LIKELY_REAL,0.8608,https://www.courtlistener.com/opinion/10670865/noland-v-land-of-the-free-lp/,"Noland v. Land of the Free, L.P.",e697e44,duplicate,duplicate of prior citation,
mezu_v_mezu_10-29-2025_order.pdf,"Shahid v. Esaam, 918 S.E.2d 198 (gactapp 2025)","...ersal of existing law or the establishment of new law.""); Cal. Rules of Court, rule 8.276 (permits the court to sanction a party who unreasonable violates the rules of court). Accord Shahid v. Esaam, 918 S.E.2d 198, 202, 202 n.17 (Ga. Ct. App. 2025) (imposing monetary sanction under Court of Appe",uncertain,Shahid v. Esaam,Shahid,Esaam,918,S.E.2d,198,gactapp,2025,,,,FALSE,,,POSSIBLE_MATCH,0.825,https://www.courtlistener.com/opinion/10620062/nimat-shahid-v-sufyan-esaam/,Nimat Shahid v. Sufyan Esaam,cc46446,approved,,
mezu_v_mezu_10-29-2025_order.pdf,"Milburn v. Milburn, 142 Md. App. 518 (2002)","...s appeal is properly before this Court. Although the parties did not address this issue in their briefs, the issue of appellate jurisdiction may be raised by the Court sua sponte. Milburn v. Milburn, 142 Md. App. 518, 522-23 (2002). 12 Father has filed other motions in this case that are not the ",uncertain,Milburn v. Milburn,Milburn,Milburn,142,Md. App.,518,mdctspecapp,2002,,,,FALSE,,,VERIFIED,1.0,https://www.courtlistener.com/opinion/2301386/milburn-v-milburn/,Milburn v. Milburn,e697e44,approved,,
mezu_v_mezu_10-29-2025_order.pdf,"Suburban Sanitary Comm'n v. Bowen, 410 Md. 287 (2009)","...ubject of this appeal. We will not address them. 25 Subject to certain exceptions, a party may appeal only from a final judgment rendered by the trial court. Wash. Suburban Sanitary Comm'n v. Bowen, 410 Md. 287, 294 (2009); Pattison v. Pattison, 254 Md. App. 294, 307 (2022); Md. Code Ann., Cts. &",uncertain,Suburban Sanitary Commission v. Bowen,Suburban Sanitary Commission,Bowen,410,Md.,287,md,2009,,,,FALSE,,,,,,,,,,
mezu_v_mezu_10-29-2025_order.pdf,"Pattison v. Pattison, 254 Md. App. 294 (2022)",".... 25 Subject to certain exceptions, a party may appeal only from a final judgment rendered by the trial court. Wash. Suburban Sanitary Comm'n v. Bowen, 410 Md. 287, 294 (2009); Pattison v. Pattison, 254 Md. App. 294, 307 (2022); Md. Code Ann., Cts. & Jud. Proc. Art. (""CJ"") § 12-301 (2020 Repl. Vo",uncertain,Pattison v. Pattison,Pattison,Pattison,254,Md. App.,294,mdctspecapp,2022,,,,FALSE,,,LIKELY_REAL,0.9,https://www.courtlistener.com/opinion/6477247/pattison-v-pattison/,Pattison v. Pattison,e697e44,approved,,
